310,42,Face to face tertiary monitoring,MILES_HIKED,192,primis in faucibus orci luctus et ultrices posuere cubilia curae nulla dapibus dolor vel est donec odio justo sollicitudin ut,04/22/2019,COMPLETE,false
311,932,Intuitive asymmetric ability,HIKEABLE_MILES,94,sit amet sem fusce consequat nulla nisl nunc nisl duis bibendum felis sed interdum venenatis turpis enim blandit mi in,10/28/2019,NOT_STARTED,false
312,602,Reduced exuding info-mediaries,NUMBER_HIKES,173,,07/14/2019,COMPLETE,true
313,557,Distributed bifurcated array,FEET_ASCENDED,258,,02/06/2019,NOT_STARTED,false
314,247,Devolved exuding moratorium,FEET_ASCENDED,141,justo in blandit ultrices enim lorem ipsum dolor sit amet consectetuer adipiscing elit,10/21/2019,IN_PROGRESS,true
315,118,Face to face fresh-thinking superstructure,NUMBER_HIKES,238,platea dictumst morbi vestibulum velit id pretium iaculis diam erat fermentum justo,01/20/2019,COMPLETE,true
316,694,Assimilated zero tolerance algorithm,MILES_HIKED,243,consequat in consequat ut nulla sed accumsan felis ut at dolor quis odio consequat varius integer ac,04/13/2019,IN_PROGRESS,false
317,850,Assimilated attitude-oriented encoding,HIKE_DIFFICULTY,16,viverra diam vitae quam suspendisse potenti nullam porttitor lacus at turpis donec posuere metus,06/25/2019,NOT_STARTED,true
318,210,Persevering high-level Graphical User Interface,MILES_HIKED,262,eget rutrum at lorem integer tincidunt ante vel ipsum praesent blandit lacinia erat vestibulum sed magna at nunc commodo,03/14/2019,NOT_STARTED,false
319,778,Virtual dynamic software,HIKEABLE_MILES,77,lacus at velit vivamus vel nulla eget eros elementum pellentesque quisque porta,01/19/2019,IN_PROGRESS,false
320,232,Ameliorated client-driven emulation,FEET_ASCENDED,263,pellentesque eget nunc donec quis orci eget orci vehicula condimentum curabitur in libero ut,10/19/2019,COMPLETE,true
321,245,Proactive tangible software,NUMBER_HIKES,56,,09/03/2019,NOT_STARTED,false
322,181,Secured even-keeled frame,MILES_HIKED,205,ultrices posuere cubilia curae duis faucibus accumsan odio curabitur convallis duis consequat dui nec nisi volutpat eleifend donec ut dolor,08/31/2019,NOT_STARTED,false
323,912,Automated exuding conglomeration,NUMBER_HIKES,93,nunc donec quis orci eget orci vehicula condimentum curabitur in libero ut massa volutpat,07/25/2019,NOT_STARTED,true
324,707,Upgradable uniform software,NUMBER_HIKES,75,vel nulla eget eros elementum pellentesque quisque porta volutpat erat quisque erat eros viverra,06/30/2019,NOT_STARTED,false
325,907,Open-architected non-volatile open system,MILES_HIKED,207,elementum eu interdum eu tincidunt in leo maecenas pulvinar lobortis est phasellus sit amet erat nulla tempus,11/24/2019,NOT_STARTED,true
326,741,Grass-roots modular frame,HIKE_DIFFICULTY,219,nibh ligula nec sem duis aliquam convallis nunc proin at,10/24/2019,NOT_STARTED,false
327,722,Progressive multimedia ability,HIKE_DIFFICULTY,13,condimentum neque sapien placerat ante nulla justo aliquam quis turpis eget elit sodales scelerisque mauris sit amet eros suspendisse,07/24/2019,NOT_STARTED,true
328,440,Business-focused mobile hub,MILES_HIKED,25,habitasse platea dictumst maecenas ut massa quis augue luctus tincidunt nulla mollis molestie lorem quisque ut erat,10/04/2019,COMPLETE,false
329,852,Operative methodical function,FEET_ASCENDED,80,,07/17/2019,IN_PROGRESS,false
330,218,Implemented explicit policy,HIKEABLE_MILES,251,sit amet cursus id turpis integer aliquet massa id lobortis convallis tortor risus,06/19/2019,IN_PROGRESS,false
331,259,Synergistic asymmetric utilisation,MILES_HIKED,137,scelerisque quam turpis adipiscing lorem vitae mattis nibh ligula nec sem duis aliquam convallis nunc proin at turpis a,05/30/2019,COMPLETE,false
332,527,Secured 6th generation circuit,HIKE_DIFFICULTY,157,phasellus id sapien in sapien iaculis congue vivamus metus arcu adipiscing molestie hendrerit at vulputate,01/27/2019,NOT_STARTED,false
333,339,Organic methodical encryption,HIKE_DIFFICULTY,152,nisi nam ultrices libero non mattis pulvinar nulla pede ullamcorper augue a suscipit,11/05/2019,NOT_STARTED,false
334,821,Operative content-based initiative,HIKEABLE_MILES,203,mauris laoreet ut rhoncus aliquet pulvinar sed nisl nunc rhoncus dui vel sem sed,03/01/2019,IN_PROGRESS,true
335,975,Innovative homogeneous pricing structure,HIKE_DIFFICULTY,24,erat nulla tempus vivamus in felis eu sapien cursus vestibulum proin eu mi,10/21/2019,NOT_STARTED,false
336,924,Integrated needs-based superstructure,FEET_ASCENDED,68,natoque penatibus et magnis dis parturient montes nascetur ridiculus mus etiam vel augue vestibulum rutrum rutrum,01/02/2020,NOT_STARTED,false
337,368,Organized reciprocal monitoring,NUMBER_HIKES,120,nulla nunc purus phasellus in felis donec semper sapien a libero,02/14/2019,COMPLETE,true
338,847,Balanced stable instruction set,MILES_HIKED,225,ut odio cras mi pede malesuada in imperdiet et commodo vulputate justo in blandit ultrices enim lorem ipsum,05/17/2019,NOT_STARTED,false
339,194,Organized exuding artificial intelligence,FEET_ASCENDED,144,,04/17/2019,NOT_STARTED,true
340,804,Progressive non-volatile budgetary management,NUMBER_HIKES,235,eleifend pede libero quis orci nullam molestie nibh in lectus pellentesque at nulla suspendisse,09/12/2019,COMPLETE,true
341,9,Synergistic leading edge database,NUMBER_HIKES,96,aenean fermentum donec ut mauris eget massa tempor convallis nulla neque libero convallis,08/27/2019,IN_PROGRESS,false
342,100,Distributed optimal archive,NUMBER_HIKES,142,,11/11/2019,COMPLETE,false
343,960,Persevering regional encoding,FEET_ASCENDED,19,consequat varius integer ac leo pellentesque ultrices mattis odio donec vitae nisi nam,10/15/2019,NOT_STARTED,true
344,45,Distributed local groupware,HIKE_DIFFICULTY,212,non pretium quis lectus suspendisse potenti in eleifend quam a odio,08/26/2019,COMPLETE,true
345,178,Integrated demand-driven project,NUMBER_HIKES,59,ac leo pellentesque ultrices mattis odio donec vitae nisi nam ultrices libero non mattis pulvinar nulla pede,04/14/2019,IN_PROGRESS,false
346,957,Face to face national monitoring,HIKEABLE_MILES,298,lorem integer tincidunt ante vel ipsum praesent blandit lacinia erat vestibulum sed magna at,12/08/2019,IN_PROGRESS,true
347,385,Vision-oriented multi-state Graphical User Interface,FEET_ASCENDED,5,odio consequat varius integer ac leo pellentesque ultrices mattis odio donec,07/09/2019,IN_PROGRESS,false
348,96,Open-source executive project,HIKE_DIFFICULTY,47,ante ipsum primis in faucibus orci luctus et ultrices posuere cubilia curae donec pharetra magna vestibulum aliquet ultrices erat,06/27/2019,COMPLETE,true
349,333,Up-sized contextually-based protocol,HIKE_DIFFICULTY,112,ac neque duis bibendum morbi non quam nec dui luctus rutrum nulla tellus in sagittis dui vel,03/30/2019,NOT_STARTED,true
350,716,Cross-platform mobile open system,MILES_HIKED,10,eu massa donec dapibus duis at velit eu est congue elementum in hac habitasse platea dictumst morbi,07/01/2019,NOT_STARTED,true
351,585,Enterprise-wide scalable toolset,NUMBER_HIKES,80,nisi nam ultrices libero non mattis pulvinar nulla pede ullamcorper augue a suscipit nulla elit,03/17/2019,NOT_STARTED,false
352,598,Compatible eco-centric synergy,NUMBER_HIKES,217,,08/18/2019,IN_PROGRESS,true
353,802,Secured 24 hour neural-net,NUMBER_HIKES,5,consectetuer adipiscing elit proin risus praesent lectus vestibulum quam sapien varius ut blandit non interdum in,07/19/2019,IN_PROGRESS,true
354,2,Phased composite initiative,NUMBER_HIKES,285,potenti cras in purus eu magna vulputate luctus cum sociis,05/16/2019,NOT_STARTED,true
355,624,Balanced real-time data-warehouse,HIKEABLE_MILES,143,accumsan tortor quis turpis sed ante vivamus tortor duis mattis egestas metus aenean fermentum donec ut mauris eget massa tempor,12/05/2019,NOT_STARTED,false
356,466,Pre-emptive radical superstructure,FEET_ASCENDED,37,suspendisse potenti cras in purus eu magna vulputate luctus cum sociis natoque penatibus et magnis,11/20/2019,IN_PROGRESS,true
357,955,Vision-oriented mobile portal,FEET_ASCENDED,185,vivamus vel nulla eget eros elementum pellentesque quisque porta volutpat erat quisque,05/02/2019,NOT_STARTED,true
358,76,Object-based transitional adapter,FEET_ASCENDED,192,,10/18/2019,IN_PROGRESS,false
359,791,Visionary even-keeled infrastructure,MILES_HIKED,68,tristique in tempus sit amet sem fusce consequat nulla nisl nunc,11/05/2019,COMPLETE,false
360,741,Focused coherent secured line,MILES_HIKED,174,mauris enim leo rhoncus sed vestibulum sit amet cursus id turpis integer aliquet massa id lobortis convallis,07/09/2019,NOT_STARTED,false
361,936,Advanced 24 hour model,FEET_ASCENDED,218,massa id nisl venenatis lacinia aenean sit amet justo morbi ut odio,09/01/2019,IN_PROGRESS,false
362,192,Synchronised attitude-oriented hub,HIKEABLE_MILES,15,ipsum aliquam non mauris morbi non lectus aliquam sit amet diam in magna bibendum imperdiet nullam orci pede venenatis non,01/03/2020,COMPLETE,true
363,176,Organized system-worthy Graphic Interface,HIKEABLE_MILES,191,,07/23/2019,COMPLETE,false
364,659,Up-sized foreground function,NUMBER_HIKES,275,at vulputate vitae nisl aenean lectus pellentesque eget nunc donec quis orci eget,12/26/2019,COMPLETE,true
365,5,Secured multi-tasking toolset,MILES_HIKED,15,sagittis nam congue risus semper porta volutpat quam pede lobortis ligula sit amet eleifend pede libero quis orci nullam molestie,02/24/2019,NOT_STARTED,false
366,65,Devolved object-oriented interface,FEET_ASCENDED,142,id mauris vulputate elementum nullam varius nulla facilisi cras non velit nec nisi vulputate nonummy,08/25/2019,NOT_STARTED,true
367,79,Mandatory regional capability,NUMBER_HIKES,98,felis sed interdum venenatis turpis enim blandit mi in porttitor pede justo eu massa,07/16/2019,IN_PROGRESS,true
368,16,Synergistic 24 hour groupware,HIKEABLE_MILES,271,a libero nam dui proin leo odio porttitor id consequat,04/08/2019,IN_PROGRESS,false
369,393,Multi-lateral explicit implementation,MILES_HIKED,1,,04/10/2019,NOT_STARTED,false
370,771,Synergistic optimal structure,NUMBER_HIKES,162,,08/29/2019,NOT_STARTED,false
371,16,Re-contextualized dynamic paradigm,FEET_ASCENDED,84,cum sociis natoque penatibus et magnis dis parturient montes nascetur ridiculus mus etiam vel augue vestibulum rutrum rutrum neque,01/29/2019,COMPLETE,true
372,74,Fundamental uniform solution,HIKE_DIFFICULTY,3,nulla suscipit ligula in lacus curabitur at ipsum ac tellus semper interdum mauris,08/15/2019,IN_PROGRESS,true
373,34,Front-line empowering parallelism,NUMBER_HIKES,133,purus sit amet nulla quisque arcu libero rutrum ac lobortis vel dapibus at diam nam tristique tortor eu pede,04/22/2019,COMPLETE,false
374,36,Advanced asynchronous hierarchy,HIKE_DIFFICULTY,105,risus praesent lectus vestibulum quam sapien varius ut blandit non interdum in ante vestibulum ante ipsum primis in faucibus,09/21/2019,IN_PROGRESS,false
375,533,Open-architected object-oriented contingency,FEET_ASCENDED,71,vestibulum aliquet ultrices erat tortor sollicitudin mi sit amet lobortis sapien sapien,08/23/2019,COMPLETE,false
376,742,Versatile high-level synergy,FEET_ASCENDED,283,hendrerit at vulputate vitae nisl aenean lectus pellentesque eget nunc donec quis orci eget orci vehicula condimentum,08/06/2019,IN_PROGRESS,false
377,535,Extended radical system engine,NUMBER_HIKES,234,rhoncus aliquam lacus morbi quis tortor id nulla ultrices aliquet maecenas,08/12/2019,IN_PROGRESS,true
378,79,Configurable hybrid database,HIKE_DIFFICULTY,58,purus sit amet nulla quisque arcu libero rutrum ac lobortis vel dapibus at diam nam tristique,05/15/2019,NOT_STARTED,false
379,406,Progressive composite access,FEET_ASCENDED,186,diam cras pellentesque volutpat dui maecenas tristique est et tempus semper est quam pharetra magna ac consequat,03/22/2019,NOT_STARTED,false
380,255,Vision-oriented discrete implementation,NUMBER_HIKES,235,urna pretium nisl ut volutpat sapien arcu sed augue aliquam erat volutpat in congue etiam justo etiam pretium iaculis,02/04/2019,NOT_STARTED,true
381,338,Intuitive holistic model,MILES_HIKED,161,lobortis ligula sit amet eleifend pede libero quis orci nullam molestie nibh in lectus pellentesque at nulla,06/08/2019,NOT_STARTED,false
382,888,Implemented regional synergy,MILES_HIKED,35,cubilia curae mauris viverra diam vitae quam suspendisse potenti nullam porttitor lacus at turpis donec posuere metus vitae ipsum aliquam,06/15/2019,COMPLETE,false
383,853,Synergistic executive hardware,HIKEABLE_MILES,4,sodales scelerisque mauris sit amet eros suspendisse accumsan tortor quis turpis sed ante vivamus,01/24/2019,IN_PROGRESS,false
384,634,Ergonomic scalable throughput,NUMBER_HIKES,254,at vulputate vitae nisl aenean lectus pellentesque eget nunc donec quis orci eget orci vehicula condimentum curabitur,11/20/2019,IN_PROGRESS,false
385,590,Enhanced next generation encoding,NUMBER_HIKES,214,nascetur ridiculus mus vivamus vestibulum sagittis sapien cum sociis natoque penatibus et magnis dis parturient montes nascetur,10/13/2019,NOT_STARTED,false
386,308,Optimized actuating migration,HIKEABLE_MILES,63,,09/23/2019,COMPLETE,false
387,242,Future-proofed demand-driven firmware,NUMBER_HIKES,135,id turpis integer aliquet massa id lobortis convallis tortor risus dapibus augue vel accumsan,05/16/2019,COMPLETE,false
388,374,Multi-channelled tangible superstructure,HIKE_DIFFICULTY,181,vulputate ut ultrices vel augue vestibulum ante ipsum primis in faucibus orci luctus,01/08/2020,IN_PROGRESS,false
389,692,Polarised well-modulated architecture,HIKEABLE_MILES,295,eget vulputate ut ultrices vel augue vestibulum ante ipsum primis in faucibus orci luctus et ultrices posuere,11/20/2019,IN_PROGRESS,false
390,789,Integrated next generation encryption,FEET_ASCENDED,252,volutpat convallis morbi odio odio elementum eu interdum eu tincidunt in leo maecenas pulvinar lobortis est phasellus sit,03/31/2019,NOT_STARTED,true
391,135,Re-contextualized dynamic definition,MILES_HIKED,254,,08/31/2019,COMPLETE,true
392,391,Enterprise-wide optimizing algorithm,MILES_HIKED,83,in faucibus orci luctus et ultrices posuere cubilia curae mauris viverra diam,01/07/2020,IN_PROGRESS,false
393,840,Diverse full-range Graphic Interface,MILES_HIKED,129,metus aenean fermentum donec ut mauris eget massa tempor convallis nulla,08/05/2019,IN_PROGRESS,false
394,601,Function-based upward-trending help-desk,MILES_HIKED,262,nonummy integer non velit donec diam neque vestibulum eget vulputate ut ultrices vel augue vestibulum,12/22/2019,NOT_STARTED,true
395,773,Down-sized needs-based circuit,HIKEABLE_MILES,41,libero quis orci nullam molestie nibh in lectus pellentesque at nulla suspendisse,04/25/2019,NOT_STARTED,true
396,423,Adaptive explicit core,NUMBER_HIKES,207,pulvinar nulla pede ullamcorper augue a suscipit nulla elit ac nulla sed vel enim sit amet,05/13/2019,COMPLETE,true
397,963,Automated 24 hour open system,HIKEABLE_MILES,112,ultrices posuere cubilia curae duis faucibus accumsan odio curabitur convallis duis consequat dui nec nisi volutpat eleifend,01/15/2020,COMPLETE,false
398,368,Expanded regional architecture,FEET_ASCENDED,235,fusce posuere felis sed lacus morbi sem mauris laoreet ut rhoncus aliquet pulvinar sed,05/17/2019,IN_PROGRESS,false
399,582,Profound mission-critical toolset,HIKEABLE_MILES,171,vulputate luctus cum sociis natoque penatibus et magnis dis parturient montes nascetur ridiculus mus vivamus vestibulum sagittis sapien cum sociis,04/14/2019,NOT_STARTED,true
400,99,Business-focused human-resource orchestration,HIKEABLE_MILES,283,ante ipsum primis in faucibus orci luctus et ultrices posuere cubilia curae mauris viverra diam vitae quam suspendisse,02/24/2019,IN_PROGRESS,false
401,494,Diverse homogeneous core,FEET_ASCENDED,257,in congue etiam justo etiam pretium iaculis justo in hac habitasse,12/13/2019,NOT_STARTED,false
402,186,Digitized coherent toolset,MILES_HIKED,298,commodo placerat praesent blandit nam nulla integer pede justo lacinia eget tincidunt eget tempus vel pede,01/05/2020,COMPLETE,true
403,966,Decentralized radical info-mediaries,NUMBER_HIKES,161,,02/07/2019,NOT_STARTED,true
404,637,Function-based executive success,HIKEABLE_MILES,114,donec diam neque vestibulum eget vulputate ut ultrices vel augue,07/23/2019,IN_PROGRESS,false
405,556,Managed mobile focus group,HIKE_DIFFICULTY,142,blandit mi in porttitor pede justo eu massa donec dapibus duis at velit eu est congue elementum,03/27/2019,NOT_STARTED,false
406,96,Managed national architecture,MILES_HIKED,271,justo sit amet sapien dignissim vestibulum vestibulum ante ipsum primis in faucibus orci,02/28/2019,COMPLETE,false
407,265,Up-sized holistic alliance,FEET_ASCENDED,285,cubilia curae nulla dapibus dolor vel est donec odio justo sollicitudin ut,06/01/2019,COMPLETE,false
408,101,Automated clear-thinking local area network,HIKEABLE_MILES,292,,05/13/2019,NOT_STARTED,false
409,471,Re-engineered fresh-thinking utilisation,NUMBER_HIKES,162,a ipsum integer a nibh in quis justo maecenas rhoncus aliquam lacus morbi quis,10/04/2019,COMPLETE,false
410,202,Profound homogeneous alliance,FEET_ASCENDED,260,phasellus sit amet erat nulla tempus vivamus in felis eu sapien cursus vestibulum proin eu mi nulla ac,09/19/2019,IN_PROGRESS,false
411,556,Customizable dynamic intranet,FEET_ASCENDED,259,pede posuere nonummy integer non velit donec diam neque vestibulum eget vulputate ut ultrices vel augue vestibulum ante,10/04/2019,NOT_STARTED,true
412,767,Extended impactful intranet,MILES_HIKED,81,ante ipsum primis in faucibus orci luctus et ultrices posuere cubilia,03/08/2019,COMPLETE,true
413,382,Monitored didactic leverage,HIKE_DIFFICULTY,185,in porttitor pede justo eu massa donec dapibus duis at velit eu est congue elementum in hac,12/04/2019,IN_PROGRESS,false
414,715,Polarised executive protocol,HIKEABLE_MILES,22,,05/13/2019,IN_PROGRESS,false
415,646,Upgradable bottom-line analyzer,HIKEABLE_MILES,257,quis lectus suspendisse potenti in eleifend quam a odio in hac habitasse platea dictumst,11/07/2019,NOT_STARTED,true
416,639,Function-based real-time moratorium,MILES_HIKED,292,vivamus vel nulla eget eros elementum pellentesque quisque porta volutpat erat,12/24/2019,NOT_STARTED,false
417,35,Enterprise-wide didactic application,FEET_ASCENDED,142,lectus suspendisse potenti in eleifend quam a odio in hac habitasse platea dictumst,10/24/2019,NOT_STARTED,false
418,37,Innovative homogeneous encryption,NUMBER_HIKES,151,proin risus praesent lectus vestibulum quam sapien varius ut blandit non interdum in ante vestibulum,05/10/2019,NOT_STARTED,true
419,534,Visionary 24/7 secured line,NUMBER_HIKES,299,in sagittis dui vel nisl duis ac nibh fusce lacus purus aliquet at feugiat non pretium,11/02/2019,IN_PROGRESS,false
420,673,Diverse non-volatile alliance,HIKEABLE_MILES,13,,07/05/2019,COMPLETE,true
421,839,Business-focused exuding protocol,MILES_HIKED,97,molestie lorem quisque ut erat curabitur gravida nisi at nibh in hac habitasse platea dictumst aliquam augue quam,08/17/2019,IN_PROGRESS,true
422,542,Organized user-facing knowledge user,NUMBER_HIKES,185,,02/16/2019,IN_PROGRESS,false
423,542,Robust bandwidth-monitored orchestration,MILES_HIKED,70,gravida sem praesent id massa id nisl venenatis lacinia aenean sit amet justo morbi,11/05/2019,COMPLETE,true
424,483,Intuitive zero administration access,HIKE_DIFFICULTY,3,,03/02/2019,COMPLETE,false
425,997,Business-focused radical support,MILES_HIKED,53,,06/25/2019,COMPLETE,false
426,370,Polarised 4th generation migration,FEET_ASCENDED,232,,12/14/2019,IN_PROGRESS,true
427,724,Right-sized neutral structure,MILES_HIKED,203,vestibulum ante ipsum primis in faucibus orci luctus et ultrices posuere,06/25/2019,COMPLETE,true
428,44,Face to face bandwidth-monitored implementation,FEET_ASCENDED,180,rutrum at lorem integer tincidunt ante vel ipsum praesent blandit lacinia erat,12/19/2019,COMPLETE,false
429,757,Seamless reciprocal budgetary management,NUMBER_HIKES,267,erat id mauris vulputate elementum nullam varius nulla facilisi cras non velit nec nisi vulputate nonummy maecenas tincidunt lacus at,08/04/2019,IN_PROGRESS,false
430,410,Integrated interactive definition,MILES_HIKED,138,pretium quis lectus suspendisse potenti in eleifend quam a odio in hac habitasse platea,02/10/2019,COMPLETE,true
431,821,Organized bottom-line productivity,NUMBER_HIKES,90,varius ut blandit non interdum in ante vestibulum ante ipsum primis in faucibus orci luctus et ultrices posuere cubilia,10/26/2019,NOT_STARTED,false
432,770,Distributed optimal groupware,HIKE_DIFFICULTY,219,,04/30/2019,NOT_STARTED,false
433,673,Extended zero defect functionalities,MILES_HIKED,23,neque libero convallis eget eleifend luctus ultricies eu nibh quisque id justo,08/04/2019,COMPLETE,true
434,915,Realigned 24/7 emulation,HIKE_DIFFICULTY,278,aliquam erat volutpat in congue etiam justo etiam pretium iaculis justo in hac habitasse platea dictumst etiam faucibus cursus,07/10/2019,COMPLETE,true
435,905,De-engineered stable budgetary management,HIKE_DIFFICULTY,177,sapien sapien non mi integer ac neque duis bibendum morbi non quam nec dui luctus rutrum nulla tellus,05/26/2019,IN_PROGRESS,true
436,550,User-friendly reciprocal array,HIKEABLE_MILES,194,duis faucibus accumsan odio curabitur convallis duis consequat dui nec nisi volutpat eleifend donec ut dolor morbi,05/09/2019,NOT_STARTED,false
437,765,Compatible logistical Graphical User Interface,HIKE_DIFFICULTY,204,rutrum neque aenean auctor gravida sem praesent id massa id nisl venenatis lacinia aenean,05/20/2019,COMPLETE,false
438,51,Optional intermediate paradigm,HIKE_DIFFICULTY,108,,07/21/2019,NOT_STARTED,true
439,26,Right-sized systemic policy,HIKE_DIFFICULTY,244,ipsum primis in faucibus orci luctus et ultrices posuere cubilia curae duis faucibus accumsan odio curabitur convallis,01/20/2019,COMPLETE,true
440,960,Total multimedia middleware,HIKEABLE_MILES,126,,01/24/2019,IN_PROGRESS,false
441,414,Cloned even-keeled concept,FEET_ASCENDED,97,mi nulla ac enim in tempor turpis nec euismod scelerisque quam turpis adipiscing lorem vitae mattis,10/06/2019,COMPLETE,false
442,151,Realigned radical info-mediaries,NUMBER_HIKES,274,,03/24/2019,NOT_STARTED,true
443,132,Up-sized object-oriented array,HIKE_DIFFICULTY,92,libero nullam sit amet turpis elementum ligula vehicula consequat morbi a ipsum integer a nibh in,11/23/2019,COMPLETE,true
444,684,Versatile logistical synergy,NUMBER_HIKES,192,ante vivamus tortor duis mattis egestas metus aenean fermentum donec,03/19/2019,IN_PROGRESS,true
445,565,Organized reciprocal groupware,NUMBER_HIKES,71,,05/07/2019,NOT_STARTED,false
446,699,Object-based static Graphical User Interface,HIKEABLE_MILES,198,cubilia curae donec pharetra magna vestibulum aliquet ultrices erat tortor sollicitudin mi sit amet,09/20/2019,NOT_STARTED,false
447,163,Multi-channelled analyzing architecture,NUMBER_HIKES,279,cursus urna ut tellus nulla ut erat id mauris vulputate elementum nullam varius nulla facilisi cras non,09/20/2019,NOT_STARTED,true
448,81,Decentralized mission-critical toolset,MILES_HIKED,241,,02/28/2019,NOT_STARTED,true
449,235,Reverse-engineered zero defect standardization,MILES_HIKED,273,orci pede venenatis non sodales sed tincidunt eu felis fusce posuere,05/01/2019,COMPLETE,true
450,33,Multi-layered value-added project,MILES_HIKED,298,vulputate nonummy maecenas tincidunt lacus at velit vivamus vel nulla eget eros elementum pellentesque quisque porta volutpat,05/31/2019,NOT_STARTED,false
451,647,Optional uniform artificial intelligence,HIKE_DIFFICULTY,257,cras in purus eu magna vulputate luctus cum sociis natoque penatibus et magnis dis parturient montes nascetur ridiculus mus vivamus,12/28/2019,COMPLETE,true
452,140,Organized bottom-line frame,FEET_ASCENDED,298,,11/05/2019,NOT_STARTED,false
453,637,Progressive modular orchestration,NUMBER_HIKES,207,ac leo pellentesque ultrices mattis odio donec vitae nisi nam ultrices libero non mattis pulvinar nulla pede ullamcorper augue,05/27/2019,NOT_STARTED,false
454,798,Digitized full-range extranet,HIKE_DIFFICULTY,21,magna bibendum imperdiet nullam orci pede venenatis non sodales sed tincidunt eu felis fusce posuere felis sed,11/04/2019,IN_PROGRESS,false
455,625,Optimized responsive analyzer,NUMBER_HIKES,115,lectus in est risus auctor sed tristique in tempus sit amet sem fusce consequat nulla nisl nunc nisl,09/25/2019,COMPLETE,false
456,161,Fully-configurable demand-driven local area network,HIKEABLE_MILES,296,diam vitae quam suspendisse potenti nullam porttitor lacus at turpis donec posuere metus vitae ipsum aliquam,06/29/2019,IN_PROGRESS,false
457,111,Future-proofed analyzing application,HIKEABLE_MILES,75,,11/27/2019,COMPLETE,false
458,923,Advanced user-facing system engine,MILES_HIKED,236,interdum in ante vestibulum ante ipsum primis in faucibus orci,01/24/2019,IN_PROGRESS,false
459,33,Implemented fresh-thinking encryption,FEET_ASCENDED,47,eget nunc donec quis orci eget orci vehicula condimentum curabitur in libero ut massa,11/26/2019,IN_PROGRESS,false
460,765,Profit-focused motivating task-force,MILES_HIKED,46,at ipsum ac tellus semper interdum mauris ullamcorper purus sit,08/19/2019,IN_PROGRESS,true
461,941,Future-proofed 4th generation utilisation,MILES_HIKED,190,,04/30/2019,NOT_STARTED,false
462,507,Distributed asymmetric function,FEET_ASCENDED,48,ut blandit non interdum in ante vestibulum ante ipsum primis in faucibus orci luctus et ultrices posuere cubilia curae,05/14/2019,COMPLETE,false
463,663,De-engineered bandwidth-monitored flexibility,HIKE_DIFFICULTY,285,vel ipsum praesent blandit lacinia erat vestibulum sed magna at nunc commodo placerat praesent blandit nam nulla integer pede justo,05/12/2019,COMPLETE,true
464,423,Cloned 3rd generation attitude,MILES_HIKED,222,ipsum primis in faucibus orci luctus et ultrices posuere cubilia curae mauris,06/18/2019,NOT_STARTED,false
465,743,Quality-focused zero tolerance process improvement,FEET_ASCENDED,212,,03/11/2019,IN_PROGRESS,true
