0,0,Get started Hiking!,NUMBER_HIKES,5,Start the year off hiking a few trails.,01/01/2020,IN_PROGRESS,false
1,697,Organized bifurcated contingency,NUMBER_HIKES,288,sed justo pellentesque viverra pede ac diam cras pellentesque volutpat,10/30/2019,IN_PROGRESS,false
2,181,Decentralized intermediate encoding,FEET_ASCENDED,53,proin eu mi nulla ac enim in tempor turpis nec euismod scelerisque quam,11/16/2019,IN_PROGRESS,false
3,382,Sharable scalable groupware,NUMBER_HIKES,41,quis augue luctus tincidunt nulla mollis molestie lorem quisque ut erat curabitur gravida nisi at nibh in hac habitasse,11/14/2019,COMPLETE,false
4,906,Intuitive regional access,MILES_HIKED,123,vestibulum eget vulputate ut ultrices vel augue vestibulum ante ipsum primis in faucibus,10/10/2019,IN_PROGRESS,true
5,1000,Triple-buffered zero defect time-frame,HIKE_DIFFICULTY,296,eu sapien cursus vestibulum proin eu mi nulla ac enim in tempor turpis nec,01/24/2019,COMPLETE,true
6,819,Profit-focused mobile throughput,MILES_HIKED,43,imperdiet sapien urna pretium nisl ut volutpat sapien arcu sed augue aliquam erat volutpat in congue etiam justo,07/22/2019,IN_PROGRESS,true
7,916,Reverse-engineered incremental open system,MILES_HIKED,182,,12/10/2019,IN_PROGRESS,false
8,774,Open-architected asymmetric neural-net,NUMBER_HIKES,168,,07/20/2019,COMPLETE,true
9,55,Diverse national infrastructure,HIKE_DIFFICULTY,216,,08/11/2019,COMPLETE,false
10,496,Visionary 6th generation function,NUMBER_HIKES,288,in porttitor pede justo eu massa donec dapibus duis at velit eu est,01/19/2019,IN_PROGRESS,true
11,975,Exclusive systemic functionalities,MILES_HIKED,197,rutrum at lorem integer tincidunt ante vel ipsum praesent blandit lacinia erat vestibulum sed magna at nunc commodo placerat praesent,08/02/2019,NOT_STARTED,false
12,365,Face to face national hardware,FEET_ASCENDED,257,purus aliquet at feugiat non pretium quis lectus suspendisse potenti in eleifend quam a odio in hac habitasse platea,08/12/2019,NOT_STARTED,true
13,969,Up-sized mobile time-frame,FEET_ASCENDED,222,interdum mauris non ligula pellentesque ultrices phasellus id sapien in sapien iaculis congue vivamus,12/03/2019,COMPLETE,false
14,1000,Horizontal high-level knowledge user,MILES_HIKED,186,porttitor lorem id ligula suspendisse ornare consequat lectus in est risus auctor sed tristique in tempus sit amet sem fusce,06/19/2019,IN_PROGRESS,true
15,163,Proactive tertiary process improvement,MILES_HIKED,183,eget congue eget semper rutrum nulla nunc purus phasellus in felis donec semper sapien a libero nam dui,12/23/2019,IN_PROGRESS,true
16,386,Inverse next generation intranet,MILES_HIKED,44,nulla nunc purus phasellus in felis donec semper sapien a libero nam dui proin leo odio,04/30/2019,COMPLETE,true
17,959,Ameliorated mobile installation,NUMBER_HIKES,99,,09/09/2019,IN_PROGRESS,true
18,397,Future-proofed interactive collaboration,HIKE_DIFFICULTY,190,donec vitae nisi nam ultrices libero non mattis pulvinar nulla pede ullamcorper augue a suscipit nulla elit ac nulla sed,03/12/2019,IN_PROGRESS,true
19,316,Virtual upward-trending Graphical User Interface,MILES_HIKED,67,molestie lorem quisque ut erat curabitur gravida nisi at nibh in hac habitasse platea dictumst aliquam augue quam sollicitudin vitae,02/22/2019,NOT_STARTED,false
20,459,User-centric human-resource policy,NUMBER_HIKES,92,,08/11/2019,COMPLETE,false
21,87,Future-proofed intangible productivity,FEET_ASCENDED,65,,02/04/2019,COMPLETE,true
22,442,Visionary tertiary moderator,NUMBER_HIKES,26,,03/29/2019,NOT_STARTED,true
23,193,Automated transitional capability,NUMBER_HIKES,147,,12/17/2019,IN_PROGRESS,false
24,119,Quality-focused discrete moderator,NUMBER_HIKES,78,,05/28/2019,COMPLETE,false
25,650,Profound empowering projection,HIKE_DIFFICULTY,60,sed justo pellentesque viverra pede ac diam cras pellentesque volutpat dui maecenas tristique est et tempus semper,02/17/2019,IN_PROGRESS,false
26,994,Enterprise-wide leading edge product,FEET_ASCENDED,255,interdum mauris non ligula pellentesque ultrices phasellus id sapien in,11/25/2019,NOT_STARTED,true
27,138,Visionary well-modulated utilisation,NUMBER_HIKES,275,volutpat quam pede lobortis ligula sit amet eleifend pede libero quis orci nullam molestie nibh in lectus pellentesque,04/29/2019,COMPLETE,false
28,386,Programmable transitional open architecture,NUMBER_HIKES,54,habitasse platea dictumst maecenas ut massa quis augue luctus tincidunt nulla mollis molestie lorem quisque ut erat curabitur gravida nisi,06/30/2019,IN_PROGRESS,true
29,584,Team-oriented zero defect policy,FEET_ASCENDED,9,aenean sit amet justo morbi ut odio cras mi pede malesuada,02/06/2019,NOT_STARTED,false
30,585,Open-architected coherent structure,NUMBER_HIKES,277,dictumst maecenas ut massa quis augue luctus tincidunt nulla mollis molestie lorem quisque ut erat curabitur gravida nisi,12/31/2019,COMPLETE,false
31,607,Monitored client-server contingency,HIKEABLE_MILES,271,at velit vivamus vel nulla eget eros elementum pellentesque quisque porta volutpat erat quisque,11/28/2019,NOT_STARTED,true
32,882,Exclusive real-time local area network,HIKE_DIFFICULTY,134,varius integer ac leo pellentesque ultrices mattis odio donec vitae nisi nam ultrices libero non mattis,05/20/2019,COMPLETE,true
33,767,Horizontal content-based analyzer,FEET_ASCENDED,295,duis consequat dui nec nisi volutpat eleifend donec ut dolor morbi vel lectus in quam fringilla rhoncus mauris enim,08/30/2019,NOT_STARTED,false
34,997,Robust leading edge interface,FEET_ASCENDED,293,id justo sit amet sapien dignissim vestibulum vestibulum ante ipsum primis in faucibus,11/01/2019,COMPLETE,true
35,428,Re-engineered client-driven info-mediaries,MILES_HIKED,57,,02/27/2019,IN_PROGRESS,false
36,741,Optional intangible interface,HIKEABLE_MILES,93,orci luctus et ultrices posuere cubilia curae donec pharetra magna vestibulum aliquet,02/19/2019,IN_PROGRESS,true
37,204,Inverse systemic artificial intelligence,HIKEABLE_MILES,114,praesent blandit nam nulla integer pede justo lacinia eget tincidunt eget tempus vel pede morbi porttitor lorem id ligula,08/25/2019,NOT_STARTED,false
38,873,Synergistic needs-based hub,MILES_HIKED,210,nam ultrices libero non mattis pulvinar nulla pede ullamcorper augue,04/19/2019,IN_PROGRESS,true
39,392,Multi-channelled web-enabled process improvement,HIKE_DIFFICULTY,219,lacus purus aliquet at feugiat non pretium quis lectus suspendisse potenti in eleifend quam a,05/31/2019,IN_PROGRESS,false
40,657,Horizontal non-volatile database,FEET_ASCENDED,2,eu sapien cursus vestibulum proin eu mi nulla ac enim in tempor turpis nec euismod scelerisque quam turpis adipiscing,01/08/2020,NOT_STARTED,true
41,66,User-friendly content-based process improvement,MILES_HIKED,190,integer tincidunt ante vel ipsum praesent blandit lacinia erat vestibulum,04/23/2019,COMPLETE,false
42,228,Managed motivating protocol,HIKE_DIFFICULTY,134,habitasse platea dictumst etiam faucibus cursus urna ut tellus nulla ut erat id mauris vulputate elementum,07/13/2019,COMPLETE,true
43,42,Mandatory tangible database,HIKEABLE_MILES,12,luctus rutrum nulla tellus in sagittis dui vel nisl duis ac,03/18/2019,COMPLETE,true
44,600,Persevering eco-centric firmware,NUMBER_HIKES,273,neque libero convallis eget eleifend luctus ultricies eu nibh quisque id justo sit amet sapien dignissim vestibulum vestibulum ante ipsum,10/05/2019,IN_PROGRESS,false
45,793,Extended 6th generation access,HIKE_DIFFICULTY,53,,02/04/2019,COMPLETE,false
46,216,Operative object-oriented benchmark,MILES_HIKED,121,consectetuer adipiscing elit proin interdum mauris non ligula pellentesque ultrices phasellus id sapien in sapien,03/08/2019,IN_PROGRESS,true
47,975,Function-based contextually-based access,HIKE_DIFFICULTY,297,aenean fermentum donec ut mauris eget massa tempor convallis nulla neque libero convallis eget eleifend luctus,07/08/2019,IN_PROGRESS,true
48,901,Face to face uniform software,MILES_HIKED,152,non sodales sed tincidunt eu felis fusce posuere felis sed lacus morbi sem mauris,01/21/2019,COMPLETE,true
49,262,Re-contextualized hybrid data-warehouse,NUMBER_HIKES,251,nunc rhoncus dui vel sem sed sagittis nam congue risus semper porta,01/31/2019,COMPLETE,false
50,441,Horizontal client-server architecture,HIKE_DIFFICULTY,131,,02/18/2019,NOT_STARTED,false
51,221,Right-sized optimal throughput,HIKE_DIFFICULTY,237,non mauris morbi non lectus aliquam sit amet diam in magna bibendum imperdiet nullam orci,04/19/2019,IN_PROGRESS,false
52,687,Face to face system-worthy alliance,MILES_HIKED,21,sit amet consectetuer adipiscing elit proin interdum mauris non ligula pellentesque ultrices phasellus id sapien in sapien iaculis congue vivamus,06/27/2019,IN_PROGRESS,false
53,434,Secured web-enabled data-warehouse,MILES_HIKED,225,nunc proin at turpis a pede posuere nonummy integer non,10/10/2019,COMPLETE,true
54,20,Polarised responsive utilisation,HIKE_DIFFICULTY,62,semper sapien a libero nam dui proin leo odio porttitor id consequat in consequat ut nulla,06/16/2019,COMPLETE,false
55,412,Automated next generation artificial intelligence,MILES_HIKED,20,non mauris morbi non lectus aliquam sit amet diam in magna bibendum,09/18/2019,IN_PROGRESS,false
56,438,Optimized stable model,MILES_HIKED,204,nulla pede ullamcorper augue a suscipit nulla elit ac nulla sed vel enim sit amet nunc viverra dapibus,09/06/2019,COMPLETE,false
57,8,Business-focused client-driven knowledge base,NUMBER_HIKES,4,pharetra magna vestibulum aliquet ultrices erat tortor sollicitudin mi sit amet lobortis sapien sapien non mi integer ac neque,08/30/2019,IN_PROGRESS,false
58,47,Secured foreground contingency,FEET_ASCENDED,23,in lectus pellentesque at nulla suspendisse potenti cras in purus eu magna vulputate luctus cum sociis natoque penatibus,06/13/2019,COMPLETE,false
59,737,Self-enabling empowering encryption,NUMBER_HIKES,21,vestibulum vestibulum ante ipsum primis in faucibus orci luctus et ultrices posuere cubilia curae,11/05/2019,COMPLETE,false
60,546,Upgradable client-driven definition,NUMBER_HIKES,242,pede justo eu massa donec dapibus duis at velit eu est congue elementum in hac habitasse platea dictumst morbi,03/02/2019,IN_PROGRESS,true
61,298,Progressive mission-critical contingency,MILES_HIKED,188,consequat metus sapien ut nunc vestibulum ante ipsum primis in faucibus orci luctus,07/06/2019,IN_PROGRESS,false
62,295,Re-engineered bi-directional extranet,HIKE_DIFFICULTY,17,sed tincidunt eu felis fusce posuere felis sed lacus morbi sem mauris laoreet,10/04/2019,IN_PROGRESS,false
63,361,Exclusive modular collaboration,NUMBER_HIKES,287,in libero ut massa volutpat convallis morbi odio odio elementum eu interdum,05/20/2019,NOT_STARTED,true
64,50,Progressive mobile attitude,FEET_ASCENDED,126,hendrerit at vulputate vitae nisl aenean lectus pellentesque eget nunc donec,08/25/2019,COMPLETE,true
65,753,Organic content-based help-desk,NUMBER_HIKES,130,nec sem duis aliquam convallis nunc proin at turpis a pede posuere nonummy integer non velit donec diam neque vestibulum,08/11/2019,IN_PROGRESS,true
66,538,Up-sized solution-oriented data-warehouse,HIKE_DIFFICULTY,150,nonummy integer non velit donec diam neque vestibulum eget vulputate ut ultrices vel augue vestibulum ante ipsum,12/20/2019,NOT_STARTED,false
67,910,Switchable value-added collaboration,HIKEABLE_MILES,203,luctus et ultrices posuere cubilia curae duis faucibus accumsan odio curabitur convallis duis consequat dui nec nisi,05/08/2019,NOT_STARTED,true
68,191,Multi-lateral dynamic paradigm,MILES_HIKED,247,eleifend pede libero quis orci nullam molestie nibh in lectus pellentesque,03/23/2019,IN_PROGRESS,true
69,237,Progressive 24 hour database,FEET_ASCENDED,33,,06/10/2019,NOT_STARTED,false
70,864,Intuitive secondary info-mediaries,MILES_HIKED,141,,02/28/2019,IN_PROGRESS,true
71,146,Compatible dynamic application,HIKE_DIFFICULTY,89,nec euismod scelerisque quam turpis adipiscing lorem vitae mattis nibh ligula,11/13/2019,IN_PROGRESS,false
72,842,Up-sized hybrid conglomeration,HIKE_DIFFICULTY,179,congue vivamus metus arcu adipiscing molestie hendrerit at vulputate vitae,02/03/2019,COMPLETE,true
73,218,Intuitive regional orchestration,FEET_ASCENDED,291,praesent id massa id nisl venenatis lacinia aenean sit amet justo morbi ut,04/24/2019,IN_PROGRESS,true
74,830,Visionary methodical benchmark,HIKE_DIFFICULTY,271,ut erat curabitur gravida nisi at nibh in hac habitasse platea dictumst aliquam augue quam sollicitudin,05/13/2019,NOT_STARTED,true
75,59,Visionary clear-thinking conglomeration,HIKEABLE_MILES,173,in faucibus orci luctus et ultrices posuere cubilia curae donec pharetra magna vestibulum aliquet ultrices erat tortor,11/14/2019,NOT_STARTED,true
76,435,De-engineered incremental alliance,FEET_ASCENDED,39,cum sociis natoque penatibus et magnis dis parturient montes nascetur,03/26/2019,NOT_STARTED,false
77,226,Reverse-engineered user-facing benchmark,HIKEABLE_MILES,81,sociis natoque penatibus et magnis dis parturient montes nascetur ridiculus mus vivamus vestibulum sagittis sapien cum sociis natoque penatibus,10/15/2019,COMPLETE,false
78,524,Profit-focused motivating monitoring,NUMBER_HIKES,107,etiam faucibus cursus urna ut tellus nulla ut erat id mauris,09/27/2019,NOT_STARTED,false
79,109,Right-sized zero tolerance firmware,NUMBER_HIKES,299,faucibus accumsan odio curabitur convallis duis consequat dui nec nisi volutpat eleifend donec ut dolor,09/21/2019,NOT_STARTED,true
80,206,Assimilated impactful open architecture,NUMBER_HIKES,264,vel accumsan tellus nisi eu orci mauris lacinia sapien quis libero nullam sit amet,10/29/2019,IN_PROGRESS,true
81,104,Intuitive discrete matrix,FEET_ASCENDED,199,maecenas tincidunt lacus at velit vivamus vel nulla eget eros elementum pellentesque quisque porta volutpat,02/25/2019,IN_PROGRESS,false
82,443,Polarised value-added help-desk,FEET_ASCENDED,139,nulla quisque arcu libero rutrum ac lobortis vel dapibus at diam nam tristique tortor,12/04/2019,COMPLETE,false
83,225,Cross-group maximized success,NUMBER_HIKES,160,tincidunt nulla mollis molestie lorem quisque ut erat curabitur gravida nisi at nibh in,12/13/2019,NOT_STARTED,true
84,751,Grass-roots 24/7 architecture,FEET_ASCENDED,202,vitae nisi nam ultrices libero non mattis pulvinar nulla pede ullamcorper augue,02/21/2019,COMPLETE,true
85,180,Reduced mission-critical knowledge base,FEET_ASCENDED,266,in hac habitasse platea dictumst maecenas ut massa quis augue luctus tincidunt nulla mollis molestie lorem quisque ut,08/24/2019,COMPLETE,true
86,880,Expanded systematic open architecture,HIKE_DIFFICULTY,163,id ornare imperdiet sapien urna pretium nisl ut volutpat sapien arcu,05/08/2019,NOT_STARTED,false
87,937,Diverse system-worthy middleware,FEET_ASCENDED,56,ut rhoncus aliquet pulvinar sed nisl nunc rhoncus dui vel sem sed sagittis nam congue risus semper porta volutpat quam,02/14/2019,NOT_STARTED,true
88,319,Multi-tiered value-added hub,MILES_HIKED,68,dignissim vestibulum vestibulum ante ipsum primis in faucibus orci luctus et ultrices posuere cubilia curae nulla dapibus dolor vel,08/13/2019,IN_PROGRESS,true
89,83,Versatile user-facing focus group,HIKE_DIFFICULTY,180,malesuada in imperdiet et commodo vulputate justo in blandit ultrices enim lorem ipsum dolor sit amet,10/17/2019,COMPLETE,false
90,924,Managed 24/7 approach,MILES_HIKED,164,in ante vestibulum ante ipsum primis in faucibus orci luctus et ultrices posuere cubilia,08/04/2019,NOT_STARTED,false
91,76,Decentralized upward-trending architecture,FEET_ASCENDED,199,suspendisse potenti cras in purus eu magna vulputate luctus cum sociis natoque penatibus et magnis dis parturient montes nascetur ridiculus,11/24/2019,COMPLETE,true
92,501,Business-focused intangible concept,NUMBER_HIKES,235,eget orci vehicula condimentum curabitur in libero ut massa volutpat convallis morbi odio odio elementum eu interdum eu tincidunt in,08/08/2019,IN_PROGRESS,true
93,648,Automated holistic model,HIKEABLE_MILES,255,platea dictumst aliquam augue quam sollicitudin vitae consectetuer eget rutrum at,10/25/2019,IN_PROGRESS,true
94,734,Polarised system-worthy standardization,MILES_HIKED,75,vestibulum sagittis sapien cum sociis natoque penatibus et magnis dis parturient montes nascetur ridiculus,07/04/2019,COMPLETE,true
95,311,Self-enabling holistic task-force,MILES_HIKED,247,imperdiet nullam orci pede venenatis non sodales sed tincidunt eu felis fusce posuere,05/31/2019,COMPLETE,false
96,378,Streamlined exuding core,FEET_ASCENDED,32,mauris non ligula pellentesque ultrices phasellus id sapien in sapien iaculis congue vivamus metus arcu adipiscing molestie hendrerit at,07/14/2019,IN_PROGRESS,false
97,755,Exclusive multi-tasking monitoring,MILES_HIKED,67,,02/03/2019,NOT_STARTED,false
98,592,Cross-group holistic initiative,MILES_HIKED,83,neque duis bibendum morbi non quam nec dui luctus rutrum nulla tellus in,06/22/2019,COMPLETE,true
99,853,User-friendly client-server neural-net,MILES_HIKED,207,donec vitae nisi nam ultrices libero non mattis pulvinar nulla pede ullamcorper augue a suscipit nulla elit,09/13/2019,COMPLETE,false
100,193,Synergistic exuding Graphical User Interface,FEET_ASCENDED,114,quis justo maecenas rhoncus aliquam lacus morbi quis tortor id nulla ultrices aliquet maecenas leo odio condimentum,01/31/2019,NOT_STARTED,true
101,596,Function-based modular throughput,HIKE_DIFFICULTY,215,,08/13/2019,IN_PROGRESS,true
102,381,Re-contextualized fresh-thinking Graphical User Interface,HIKE_DIFFICULTY,168,lobortis sapien sapien non mi integer ac neque duis bibendum morbi,03/03/2019,IN_PROGRESS,true
103,552,Quality-focused zero defect approach,NUMBER_HIKES,27,pulvinar nulla pede ullamcorper augue a suscipit nulla elit ac nulla sed vel enim sit amet nunc,03/28/2019,IN_PROGRESS,false
104,590,Adaptive zero tolerance data-warehouse,MILES_HIKED,18,maecenas leo odio condimentum id luctus nec molestie sed justo pellentesque viverra,06/27/2019,NOT_STARTED,false
105,615,Realigned solution-oriented protocol,NUMBER_HIKES,183,duis ac nibh fusce lacus purus aliquet at feugiat non pretium quis lectus,03/30/2019,NOT_STARTED,false
106,545,Proactive human-resource analyzer,NUMBER_HIKES,215,erat eros viverra eget congue eget semper rutrum nulla nunc purus phasellus,04/18/2019,COMPLETE,true
107,573,Synergized demand-driven core,MILES_HIKED,233,pharetra magna ac consequat metus sapien ut nunc vestibulum ante ipsum primis in,04/18/2019,IN_PROGRESS,false
108,217,Virtual zero defect structure,HIKE_DIFFICULTY,269,ut suscipit a feugiat et eros vestibulum ac est lacinia nisi venenatis tristique fusce congue diam id ornare imperdiet sapien,11/06/2019,COMPLETE,true
109,565,Robust web-enabled encryption,MILES_HIKED,222,id mauris vulputate elementum nullam varius nulla facilisi cras non velit nec nisi vulputate nonummy maecenas tincidunt,06/10/2019,IN_PROGRESS,false
110,122,Cross-group bi-directional info-mediaries,NUMBER_HIKES,121,phasellus in felis donec semper sapien a libero nam dui proin leo,06/08/2019,NOT_STARTED,false
111,150,Enhanced contextually-based hardware,HIKE_DIFFICULTY,256,,12/31/2019,COMPLETE,true
112,84,Fully-configurable holistic framework,NUMBER_HIKES,1,lacus purus aliquet at feugiat non pretium quis lectus suspendisse potenti in eleifend quam a odio in hac habitasse platea,01/26/2019,IN_PROGRESS,true
113,196,User-friendly clear-thinking collaboration,HIKE_DIFFICULTY,159,massa id nisl venenatis lacinia aenean sit amet justo morbi ut odio cras mi pede,05/28/2019,IN_PROGRESS,false
114,805,Innovative discrete encoding,HIKE_DIFFICULTY,7,ut massa quis augue luctus tincidunt nulla mollis molestie lorem quisque ut erat curabitur gravida nisi,06/25/2019,IN_PROGRESS,false
115,9,Optimized analyzing conglomeration,MILES_HIKED,145,accumsan tortor quis turpis sed ante vivamus tortor duis mattis egestas metus aenean fermentum donec,12/19/2019,IN_PROGRESS,true
116,712,Customer-focused intangible customer loyalty,HIKEABLE_MILES,16,vitae nisi nam ultrices libero non mattis pulvinar nulla pede ullamcorper augue a suscipit nulla elit ac nulla sed vel,12/06/2019,NOT_STARTED,true
117,73,Streamlined stable conglomeration,HIKE_DIFFICULTY,177,ut tellus nulla ut erat id mauris vulputate elementum nullam varius nulla facilisi cras non velit,10/20/2019,NOT_STARTED,false
118,784,Integrated mission-critical functionalities,MILES_HIKED,2,lorem integer tincidunt ante vel ipsum praesent blandit lacinia erat vestibulum sed,08/17/2019,IN_PROGRESS,false
119,993,Grass-roots fresh-thinking definition,MILES_HIKED,80,,10/26/2019,IN_PROGRESS,true
120,706,Cross-group tertiary leverage,MILES_HIKED,102,cras non velit nec nisi vulputate nonummy maecenas tincidunt lacus at velit,08/10/2019,IN_PROGRESS,false
121,34,User-centric impactful data-warehouse,NUMBER_HIKES,141,felis ut at dolor quis odio consequat varius integer ac,02/02/2019,COMPLETE,false
122,372,Synergistic systemic open system,HIKEABLE_MILES,92,,05/28/2019,COMPLETE,false
123,216,Multi-channelled bottom-line collaboration,MILES_HIKED,32,,11/26/2019,IN_PROGRESS,false
124,367,Multi-channelled intermediate superstructure,FEET_ASCENDED,137,integer a nibh in quis justo maecenas rhoncus aliquam lacus morbi quis tortor id nulla ultrices aliquet,02/11/2019,NOT_STARTED,false
125,989,Business-focused needs-based flexibility,MILES_HIKED,39,lacinia erat vestibulum sed magna at nunc commodo placerat praesent blandit nam nulla,05/13/2019,NOT_STARTED,true
126,376,Compatible user-facing software,HIKE_DIFFICULTY,62,orci luctus et ultrices posuere cubilia curae nulla dapibus dolor vel est donec,06/24/2019,COMPLETE,true
127,908,Vision-oriented didactic standardization,HIKE_DIFFICULTY,42,fusce congue diam id ornare imperdiet sapien urna pretium nisl ut volutpat sapien arcu sed,06/29/2019,NOT_STARTED,false
128,734,Optimized optimizing alliance,NUMBER_HIKES,148,,07/08/2019,NOT_STARTED,false
129,959,Synchronised web-enabled core,MILES_HIKED,92,ut massa quis augue luctus tincidunt nulla mollis molestie lorem quisque ut erat curabitur gravida nisi at nibh in,06/30/2019,NOT_STARTED,true
130,938,Team-oriented fresh-thinking knowledge base,HIKE_DIFFICULTY,146,volutpat sapien arcu sed augue aliquam erat volutpat in congue etiam justo etiam,03/26/2019,COMPLETE,false
131,868,Multi-lateral fresh-thinking strategy,NUMBER_HIKES,29,orci mauris lacinia sapien quis libero nullam sit amet turpis elementum ligula vehicula consequat,03/09/2019,NOT_STARTED,true
132,544,Advanced client-server matrices,HIKEABLE_MILES,6,enim in tempor turpis nec euismod scelerisque quam turpis adipiscing lorem vitae mattis,09/29/2019,NOT_STARTED,false
133,147,Virtual systemic open architecture,MILES_HIKED,47,pede morbi porttitor lorem id ligula suspendisse ornare consequat lectus in est risus,01/05/2020,NOT_STARTED,true
134,314,Realigned content-based matrix,NUMBER_HIKES,137,faucibus orci luctus et ultrices posuere cubilia curae donec pharetra magna vestibulum aliquet,03/19/2019,IN_PROGRESS,true
135,964,Vision-oriented value-added attitude,MILES_HIKED,285,,11/01/2019,NOT_STARTED,false
136,662,User-friendly executive task-force,NUMBER_HIKES,95,eu orci mauris lacinia sapien quis libero nullam sit amet turpis elementum ligula vehicula consequat morbi,01/16/2020,COMPLETE,false
137,107,Function-based incremental encoding,MILES_HIKED,220,,08/18/2019,COMPLETE,true
138,516,Virtual zero defect complexity,HIKEABLE_MILES,38,molestie sed justo pellentesque viverra pede ac diam cras pellentesque volutpat dui maecenas tristique est,06/07/2019,COMPLETE,false
139,349,Multi-layered context-sensitive complexity,HIKE_DIFFICULTY,204,aenean auctor gravida sem praesent id massa id nisl venenatis lacinia aenean sit amet justo morbi ut,11/03/2019,IN_PROGRESS,false
140,247,Stand-alone optimizing internet solution,NUMBER_HIKES,204,cras in purus eu magna vulputate luctus cum sociis natoque,08/17/2019,IN_PROGRESS,false
141,947,Mandatory upward-trending open architecture,NUMBER_HIKES,56,ipsum integer a nibh in quis justo maecenas rhoncus aliquam lacus morbi quis,05/17/2019,NOT_STARTED,true
142,947,Operative 5th generation data-warehouse,FEET_ASCENDED,279,id nisl venenatis lacinia aenean sit amet justo morbi ut odio cras,08/28/2019,NOT_STARTED,true
143,715,User-friendly contextually-based definition,FEET_ASCENDED,45,odio curabitur convallis duis consequat dui nec nisi volutpat eleifend donec ut dolor morbi vel lectus,06/11/2019,NOT_STARTED,true
144,846,Front-line explicit time-frame,MILES_HIKED,248,vitae consectetuer eget rutrum at lorem integer tincidunt ante vel ipsum praesent blandit lacinia erat vestibulum sed,05/31/2019,IN_PROGRESS,false
145,101,Managed impactful collaboration,FEET_ASCENDED,276,pede morbi porttitor lorem id ligula suspendisse ornare consequat lectus in est risus auctor sed tristique in,08/28/2019,NOT_STARTED,true
146,843,Public-key client-driven conglomeration,FEET_ASCENDED,207,ut ultrices vel augue vestibulum ante ipsum primis in faucibus orci luctus et,08/20/2019,COMPLETE,true
147,807,Customizable web-enabled alliance,HIKEABLE_MILES,5,cubilia curae donec pharetra magna vestibulum aliquet ultrices erat tortor sollicitudin,01/21/2019,NOT_STARTED,true
148,492,Focused foreground model,FEET_ASCENDED,19,nunc viverra dapibus nulla suscipit ligula in lacus curabitur at ipsum ac tellus semper interdum mauris ullamcorper purus sit,07/16/2019,NOT_STARTED,true
149,414,Phased object-oriented circuit,NUMBER_HIKES,15,habitasse platea dictumst etiam faucibus cursus urna ut tellus nulla ut erat id mauris vulputate elementum nullam varius nulla facilisi,07/26/2019,COMPLETE,true
150,919,Right-sized 24/7 website,MILES_HIKED,162,,06/22/2019,NOT_STARTED,false
151,125,Object-based high-level support,MILES_HIKED,150,condimentum curabitur in libero ut massa volutpat convallis morbi odio,09/17/2019,COMPLETE,false
152,779,Multi-layered encompassing infrastructure,HIKE_DIFFICULTY,158,nulla tellus in sagittis dui vel nisl duis ac nibh fusce lacus purus,07/16/2019,NOT_STARTED,false
