466,264,Ergonomic fault-tolerant framework,NUMBER_HIKES,111,ac tellus semper interdum mauris ullamcorper purus sit amet nulla quisque arcu libero rutrum,05/27/2019,COMPLETE,true
467,936,Enterprise-wide dynamic hub,HIKE_DIFFICULTY,171,tristique est et tempus semper est quam pharetra magna ac consequat,07/30/2019,COMPLETE,false
468,146,Polarised disintermediate intranet,NUMBER_HIKES,11,porta volutpat quam pede lobortis ligula sit amet eleifend pede libero quis orci,11/27/2019,COMPLETE,true
469,782,Enterprise-wide 5th generation info-mediaries,NUMBER_HIKES,127,consectetuer adipiscing elit proin interdum mauris non ligula pellentesque ultrices phasellus id sapien in sapien iaculis congue vivamus metus arcu,07/23/2019,NOT_STARTED,true
470,773,Balanced bifurcated projection,HIKE_DIFFICULTY,55,ut volutpat sapien arcu sed augue aliquam erat volutpat in congue,05/31/2019,COMPLETE,false
471,466,Synergistic actuating complexity,HIKE_DIFFICULTY,297,quis justo maecenas rhoncus aliquam lacus morbi quis tortor id nulla ultrices aliquet maecenas leo odio condimentum id luctus nec,07/10/2019,NOT_STARTED,true
472,787,User-friendly even-keeled contingency,HIKEABLE_MILES,199,vel augue vestibulum rutrum rutrum neque aenean auctor gravida sem praesent id massa id,11/05/2019,NOT_STARTED,false
473,691,Optional secondary implementation,HIKE_DIFFICULTY,26,nulla tempus vivamus in felis eu sapien cursus vestibulum proin eu mi nulla ac,04/24/2019,IN_PROGRESS,true
474,322,Right-sized regional success,HIKE_DIFFICULTY,85,pharetra magna ac consequat metus sapien ut nunc vestibulum ante ipsum primis in faucibus orci luctus et ultrices posuere cubilia,08/28/2019,IN_PROGRESS,false
475,82,Reverse-engineered systematic flexibility,NUMBER_HIKES,68,,02/25/2019,COMPLETE,false
476,803,Customizable zero administration infrastructure,HIKE_DIFFICULTY,193,integer pede justo lacinia eget tincidunt eget tempus vel pede morbi porttitor lorem id ligula suspendisse ornare consequat lectus,08/31/2019,COMPLETE,true
477,81,Pre-emptive bi-directional infrastructure,NUMBER_HIKES,162,nulla suspendisse potenti cras in purus eu magna vulputate luctus,09/18/2019,IN_PROGRESS,true
478,478,Expanded contextually-based methodology,HIKE_DIFFICULTY,208,blandit non interdum in ante vestibulum ante ipsum primis in,07/20/2019,COMPLETE,false
479,744,Polarised exuding methodology,MILES_HIKED,12,velit eu est congue elementum in hac habitasse platea dictumst morbi vestibulum velit id pretium iaculis diam erat fermentum,04/30/2019,NOT_STARTED,true
480,830,Open-source static archive,MILES_HIKED,54,aliquet at feugiat non pretium quis lectus suspendisse potenti in eleifend quam a odio in,05/09/2019,COMPLETE,true
481,332,Phased bifurcated parallelism,HIKEABLE_MILES,83,,05/03/2019,IN_PROGRESS,true
482,727,Vision-oriented background firmware,FEET_ASCENDED,175,natoque penatibus et magnis dis parturient montes nascetur ridiculus mus etiam vel augue vestibulum rutrum rutrum,08/08/2019,NOT_STARTED,true
483,504,Synergistic well-modulated internet solution,FEET_ASCENDED,143,,01/14/2020,COMPLETE,false
484,497,Universal maximized moratorium,FEET_ASCENDED,291,in magna bibendum imperdiet nullam orci pede venenatis non sodales sed tincidunt eu felis,05/21/2019,COMPLETE,true
485,935,Face to face local capability,FEET_ASCENDED,62,,03/06/2019,COMPLETE,false
486,976,Intuitive 3rd generation parallelism,HIKE_DIFFICULTY,149,faucibus accumsan odio curabitur convallis duis consequat dui nec nisi volutpat eleifend donec ut dolor morbi vel lectus in quam,03/30/2019,COMPLETE,false
487,389,Ergonomic bi-directional product,NUMBER_HIKES,168,tincidunt eget tempus vel pede morbi porttitor lorem id ligula suspendisse,12/17/2019,IN_PROGRESS,false
488,602,Integrated high-level encryption,FEET_ASCENDED,192,,01/04/2020,IN_PROGRESS,false
489,106,Sharable full-range hub,NUMBER_HIKES,172,odio justo sollicitudin ut suscipit a feugiat et eros vestibulum ac est lacinia nisi venenatis tristique fusce congue diam id,04/12/2019,COMPLETE,true
490,624,Devolved transitional ability,MILES_HIKED,141,sapien cursus vestibulum proin eu mi nulla ac enim in tempor turpis nec euismod scelerisque quam turpis,09/21/2019,NOT_STARTED,true
491,46,Multi-layered stable throughput,FEET_ASCENDED,245,,10/02/2019,COMPLETE,false
492,85,Fundamental next generation projection,MILES_HIKED,270,diam vitae quam suspendisse potenti nullam porttitor lacus at turpis donec posuere,08/08/2019,IN_PROGRESS,true
493,540,Robust optimal project,FEET_ASCENDED,254,sagittis nam congue risus semper porta volutpat quam pede lobortis ligula sit amet,07/24/2019,NOT_STARTED,true
494,755,Ameliorated logistical access,FEET_ASCENDED,36,cum sociis natoque penatibus et magnis dis parturient montes nascetur ridiculus mus vivamus vestibulum,12/12/2019,COMPLETE,false
495,877,Synergized impactful definition,HIKEABLE_MILES,215,fringilla rhoncus mauris enim leo rhoncus sed vestibulum sit amet cursus id turpis,05/27/2019,COMPLETE,true
496,178,Universal systemic application,NUMBER_HIKES,153,sagittis sapien cum sociis natoque penatibus et magnis dis parturient montes nascetur ridiculus mus etiam vel augue vestibulum rutrum rutrum,04/04/2019,NOT_STARTED,true
497,786,Digitized mission-critical adapter,HIKE_DIFFICULTY,228,suscipit a feugiat et eros vestibulum ac est lacinia nisi,09/11/2019,COMPLETE,true
498,24,Proactive optimal contingency,FEET_ASCENDED,216,pretium iaculis diam erat fermentum justo nec condimentum neque sapien placerat ante nulla justo aliquam quis,08/24/2019,IN_PROGRESS,true
499,606,Reduced object-oriented success,HIKEABLE_MILES,2,nulla eget eros elementum pellentesque quisque porta volutpat erat quisque erat eros viverra eget congue eget semper rutrum,10/05/2019,IN_PROGRESS,false
500,851,Intuitive multi-tasking orchestration,HIKE_DIFFICULTY,291,primis in faucibus orci luctus et ultrices posuere cubilia curae nulla dapibus,08/04/2019,NOT_STARTED,false
501,262,Synergized client-driven algorithm,HIKE_DIFFICULTY,17,,01/13/2020,IN_PROGRESS,false
502,125,Persevering background matrix,NUMBER_HIKES,59,vel nulla eget eros elementum pellentesque quisque porta volutpat erat,01/24/2019,COMPLETE,true
503,365,Persistent user-facing synergy,FEET_ASCENDED,289,quis augue luctus tincidunt nulla mollis molestie lorem quisque ut erat,12/01/2019,IN_PROGRESS,false
504,688,Object-based heuristic knowledge base,HIKE_DIFFICULTY,253,id consequat in consequat ut nulla sed accumsan felis ut at dolor quis odio,04/16/2019,NOT_STARTED,true
505,408,Up-sized bi-directional benchmark,MILES_HIKED,60,in faucibus orci luctus et ultrices posuere cubilia curae donec pharetra magna vestibulum aliquet ultrices erat tortor sollicitudin,10/04/2019,NOT_STARTED,false
506,171,Open-architected composite initiative,NUMBER_HIKES,5,hac habitasse platea dictumst etiam faucibus cursus urna ut tellus nulla ut erat,08/09/2019,IN_PROGRESS,true
507,496,Balanced eco-centric functionalities,HIKE_DIFFICULTY,293,,02/16/2019,IN_PROGRESS,false
508,286,Customizable zero defect infrastructure,HIKEABLE_MILES,261,iaculis diam erat fermentum justo nec condimentum neque sapien placerat ante nulla justo aliquam quis,02/28/2019,IN_PROGRESS,true
509,147,Configurable eco-centric forecast,MILES_HIKED,39,,11/14/2019,COMPLETE,true
510,692,Reverse-engineered leading edge Graphic Interface,MILES_HIKED,44,at ipsum ac tellus semper interdum mauris ullamcorper purus sit amet,11/12/2019,COMPLETE,false
511,909,Devolved upward-trending projection,FEET_ASCENDED,175,,03/21/2019,NOT_STARTED,true
512,274,Configurable attitude-oriented leverage,HIKEABLE_MILES,134,nibh in quis justo maecenas rhoncus aliquam lacus morbi quis tortor id nulla,05/31/2019,NOT_STARTED,true
513,711,Synergized 24/7 project,FEET_ASCENDED,188,mauris lacinia sapien quis libero nullam sit amet turpis elementum ligula vehicula consequat,09/06/2019,NOT_STARTED,false
514,855,Multi-tiered explicit flexibility,FEET_ASCENDED,278,magna vestibulum aliquet ultrices erat tortor sollicitudin mi sit amet lobortis sapien sapien non,01/29/2019,NOT_STARTED,false
515,441,Digitized bottom-line analyzer,HIKE_DIFFICULTY,88,ipsum primis in faucibus orci luctus et ultrices posuere cubilia curae donec pharetra magna vestibulum aliquet ultrices erat tortor,09/07/2019,COMPLETE,false
516,372,Streamlined real-time leverage,MILES_HIKED,18,natoque penatibus et magnis dis parturient montes nascetur ridiculus mus vivamus vestibulum sagittis sapien cum sociis,07/06/2019,IN_PROGRESS,true
517,961,Advanced multi-state portal,FEET_ASCENDED,155,duis mattis egestas metus aenean fermentum donec ut mauris eget massa tempor,02/27/2019,NOT_STARTED,true
518,334,Total bi-directional adapter,HIKE_DIFFICULTY,21,,07/14/2019,IN_PROGRESS,true
519,119,Pre-emptive web-enabled frame,FEET_ASCENDED,138,tempus vel pede morbi porttitor lorem id ligula suspendisse ornare consequat lectus in est risus auctor sed,05/03/2019,NOT_STARTED,true
520,588,Multi-layered attitude-oriented collaboration,FEET_ASCENDED,6,sed vestibulum sit amet cursus id turpis integer aliquet massa id lobortis convallis tortor risus dapibus augue vel,10/18/2019,COMPLETE,true
521,843,Adaptive client-driven open architecture,HIKE_DIFFICULTY,196,quis lectus suspendisse potenti in eleifend quam a odio in hac,01/11/2020,NOT_STARTED,false
522,452,Synchronised zero tolerance success,FEET_ASCENDED,134,lectus pellentesque eget nunc donec quis orci eget orci vehicula condimentum curabitur in,07/10/2019,COMPLETE,true
523,155,Re-engineered background interface,HIKE_DIFFICULTY,102,nec nisi volutpat eleifend donec ut dolor morbi vel lectus in quam fringilla rhoncus mauris enim,06/01/2019,NOT_STARTED,true
524,234,Realigned multimedia projection,HIKEABLE_MILES,215,elementum eu interdum eu tincidunt in leo maecenas pulvinar lobortis est phasellus sit amet erat nulla tempus vivamus,10/05/2019,NOT_STARTED,false
525,741,Advanced dynamic structure,NUMBER_HIKES,291,hac habitasse platea dictumst etiam faucibus cursus urna ut tellus nulla ut erat id mauris vulputate elementum nullam varius,04/17/2019,IN_PROGRESS,false
526,40,Innovative regional array,MILES_HIKED,162,,04/26/2019,NOT_STARTED,true
527,967,Stand-alone coherent projection,NUMBER_HIKES,257,cursus urna ut tellus nulla ut erat id mauris vulputate,01/26/2019,IN_PROGRESS,true
528,818,Total intangible moderator,MILES_HIKED,147,vulputate ut ultrices vel augue vestibulum ante ipsum primis in faucibus orci luctus et ultrices posuere cubilia,09/26/2019,IN_PROGRESS,true
529,228,Multi-lateral human-resource frame,NUMBER_HIKES,82,amet sem fusce consequat nulla nisl nunc nisl duis bibendum felis sed interdum venenatis turpis,11/20/2019,COMPLETE,false
530,321,Exclusive uniform neural-net,FEET_ASCENDED,2,,09/03/2019,NOT_STARTED,true
531,802,Compatible global intranet,NUMBER_HIKES,167,proin risus praesent lectus vestibulum quam sapien varius ut blandit non interdum in ante,08/20/2019,NOT_STARTED,false
532,968,Cloned disintermediate matrix,FEET_ASCENDED,207,non sodales sed tincidunt eu felis fusce posuere felis sed lacus morbi sem mauris laoreet ut,12/12/2019,IN_PROGRESS,false
533,681,Networked tangible matrices,FEET_ASCENDED,169,,12/30/2019,NOT_STARTED,false
534,667,Triple-buffered solution-oriented contingency,HIKEABLE_MILES,260,cras non velit nec nisi vulputate nonummy maecenas tincidunt lacus at velit vivamus,01/13/2020,IN_PROGRESS,true
535,958,Pre-emptive global customer loyalty,FEET_ASCENDED,297,at lorem integer tincidunt ante vel ipsum praesent blandit lacinia erat vestibulum sed magna at nunc commodo placerat,06/21/2019,COMPLETE,false
536,684,Expanded client-server moderator,HIKEABLE_MILES,75,augue vestibulum rutrum rutrum neque aenean auctor gravida sem praesent id massa id nisl,04/19/2019,COMPLETE,true
537,12,Exclusive motivating hub,NUMBER_HIKES,15,diam vitae quam suspendisse potenti nullam porttitor lacus at turpis donec posuere metus vitae ipsum aliquam non,02/22/2019,NOT_STARTED,false
538,622,Expanded bandwidth-monitored collaboration,HIKE_DIFFICULTY,299,,04/15/2019,IN_PROGRESS,true
539,60,Automated fresh-thinking moratorium,NUMBER_HIKES,223,tortor duis mattis egestas metus aenean fermentum donec ut mauris eget massa tempor convallis nulla neque libero convallis,03/04/2019,NOT_STARTED,false
540,203,Exclusive 24/7 strategy,NUMBER_HIKES,281,ultrices posuere cubilia curae mauris viverra diam vitae quam suspendisse potenti nullam porttitor lacus at turpis donec posuere metus,08/24/2019,NOT_STARTED,true
541,823,Grass-roots value-added capacity,HIKEABLE_MILES,75,vehicula consequat morbi a ipsum integer a nibh in quis justo maecenas rhoncus aliquam,01/14/2020,IN_PROGRESS,false
542,433,Monitored composite application,FEET_ASCENDED,155,proin interdum mauris non ligula pellentesque ultrices phasellus id sapien in sapien iaculis congue vivamus metus arcu adipiscing,05/19/2019,IN_PROGRESS,false
543,796,Persistent mission-critical data-warehouse,HIKEABLE_MILES,86,elementum nullam varius nulla facilisi cras non velit nec nisi vulputate nonummy,08/14/2019,COMPLETE,true
544,994,Configurable national time-frame,FEET_ASCENDED,69,posuere cubilia curae nulla dapibus dolor vel est donec odio justo sollicitudin ut suscipit a feugiat et eros vestibulum ac,07/31/2019,IN_PROGRESS,true
545,579,Exclusive radical forecast,HIKEABLE_MILES,166,condimentum neque sapien placerat ante nulla justo aliquam quis turpis eget elit sodales scelerisque mauris,10/10/2019,COMPLETE,true
546,936,Seamless reciprocal website,HIKEABLE_MILES,215,nec sem duis aliquam convallis nunc proin at turpis a pede,10/02/2019,IN_PROGRESS,true
547,528,Advanced scalable time-frame,HIKE_DIFFICULTY,8,laoreet ut rhoncus aliquet pulvinar sed nisl nunc rhoncus dui vel sem sed sagittis nam congue,03/09/2019,IN_PROGRESS,true
548,984,Fundamental discrete architecture,HIKEABLE_MILES,56,id mauris vulputate elementum nullam varius nulla facilisi cras non velit nec nisi,10/29/2019,COMPLETE,false
549,269,Grass-roots maximized contingency,MILES_HIKED,57,maecenas leo odio condimentum id luctus nec molestie sed justo pellentesque viverra pede ac,03/31/2019,COMPLETE,false
550,628,Reduced 24 hour approach,NUMBER_HIKES,128,fusce consequat nulla nisl nunc nisl duis bibendum felis sed interdum venenatis turpis enim blandit,10/01/2019,IN_PROGRESS,true
551,300,Open-architected 3rd generation throughput,HIKE_DIFFICULTY,294,pellentesque ultrices phasellus id sapien in sapien iaculis congue vivamus metus,01/06/2020,NOT_STARTED,true
552,55,User-friendly human-resource framework,MILES_HIKED,91,vivamus in felis eu sapien cursus vestibulum proin eu mi nulla ac enim in tempor turpis nec euismod scelerisque quam,11/11/2019,NOT_STARTED,true
553,927,Cross-group attitude-oriented neural-net,NUMBER_HIKES,24,,03/25/2019,COMPLETE,false
554,593,Intuitive didactic support,HIKE_DIFFICULTY,290,praesent id massa id nisl venenatis lacinia aenean sit amet,08/06/2019,COMPLETE,true
555,331,Triple-buffered contextually-based open architecture,MILES_HIKED,185,at turpis donec posuere metus vitae ipsum aliquam non mauris morbi non lectus aliquam,12/09/2019,NOT_STARTED,false
556,67,Optimized executive system engine,NUMBER_HIKES,240,amet lobortis sapien sapien non mi integer ac neque duis bibendum morbi non quam nec dui luctus rutrum nulla tellus,05/19/2019,IN_PROGRESS,true
557,509,Reactive next generation toolset,HIKE_DIFFICULTY,259,cum sociis natoque penatibus et magnis dis parturient montes nascetur ridiculus mus vivamus vestibulum sagittis sapien cum,12/07/2019,NOT_STARTED,true
558,559,Fundamental interactive project,NUMBER_HIKES,33,felis sed lacus morbi sem mauris laoreet ut rhoncus aliquet pulvinar,02/10/2019,IN_PROGRESS,false
559,146,Multi-channelled human-resource function,FEET_ASCENDED,257,nonummy maecenas tincidunt lacus at velit vivamus vel nulla eget,12/13/2019,NOT_STARTED,true
560,237,Mandatory holistic throughput,HIKEABLE_MILES,85,est quam pharetra magna ac consequat metus sapien ut nunc,08/16/2019,COMPLETE,false
561,830,Persistent tangible strategy,HIKE_DIFFICULTY,298,nisl duis bibendum felis sed interdum venenatis turpis enim blandit mi in porttitor,11/25/2019,IN_PROGRESS,false
562,846,Reduced client-driven success,HIKEABLE_MILES,88,erat eros viverra eget congue eget semper rutrum nulla nunc purus phasellus in felis donec semper sapien a libero nam,02/09/2019,COMPLETE,false
563,945,Up-sized mobile artificial intelligence,HIKEABLE_MILES,272,consequat lectus in est risus auctor sed tristique in tempus sit amet sem fusce consequat nulla nisl nunc nisl,03/26/2019,NOT_STARTED,false
564,791,Switchable stable emulation,HIKEABLE_MILES,47,,11/25/2019,COMPLETE,false
565,436,Function-based multi-tasking matrix,HIKEABLE_MILES,199,,12/16/2019,NOT_STARTED,false
566,201,Organized 24/7 internet solution,NUMBER_HIKES,286,duis faucibus accumsan odio curabitur convallis duis consequat dui nec nisi volutpat eleifend donec ut dolor,10/08/2019,IN_PROGRESS,false
567,594,Sharable attitude-oriented orchestration,HIKE_DIFFICULTY,62,nulla dapibus dolor vel est donec odio justo sollicitudin ut,01/24/2019,IN_PROGRESS,false
568,933,Inverse next generation database,NUMBER_HIKES,298,quis tortor id nulla ultrices aliquet maecenas leo odio condimentum id luctus nec molestie sed,06/01/2019,IN_PROGRESS,true
569,132,Visionary asynchronous analyzer,HIKEABLE_MILES,83,eleifend donec ut dolor morbi vel lectus in quam fringilla rhoncus mauris enim leo rhoncus sed vestibulum sit amet,05/27/2019,NOT_STARTED,true
570,624,Multi-layered incremental website,HIKE_DIFFICULTY,294,congue vivamus metus arcu adipiscing molestie hendrerit at vulputate vitae nisl aenean lectus pellentesque eget,10/11/2019,IN_PROGRESS,true
571,99,Front-line zero tolerance productivity,HIKE_DIFFICULTY,174,suspendisse potenti in eleifend quam a odio in hac habitasse platea,12/03/2019,COMPLETE,true
572,301,Enterprise-wide contextually-based artificial intelligence,HIKE_DIFFICULTY,179,et ultrices posuere cubilia curae mauris viverra diam vitae quam suspendisse potenti nullam porttitor lacus at turpis,01/16/2020,COMPLETE,false
573,311,Realigned leading edge task-force,NUMBER_HIKES,124,eget vulputate ut ultrices vel augue vestibulum ante ipsum primis in faucibus orci luctus et,02/21/2019,COMPLETE,false
574,370,Operative optimal system engine,FEET_ASCENDED,267,diam erat fermentum justo nec condimentum neque sapien placerat ante,09/07/2019,COMPLETE,true
575,167,Team-oriented context-sensitive middleware,HIKE_DIFFICULTY,134,quisque erat eros viverra eget congue eget semper rutrum nulla nunc purus,03/26/2019,IN_PROGRESS,false
576,189,Organized system-worthy focus group,NUMBER_HIKES,21,amet sem fusce consequat nulla nisl nunc nisl duis bibendum felis sed,05/05/2019,NOT_STARTED,true
577,741,Operative 24/7 leverage,HIKEABLE_MILES,121,ultrices posuere cubilia curae mauris viverra diam vitae quam suspendisse potenti nullam porttitor lacus at turpis donec,11/04/2019,IN_PROGRESS,false
578,26,Visionary explicit circuit,HIKE_DIFFICULTY,246,,03/21/2019,COMPLETE,false
579,207,Ergonomic neutral support,MILES_HIKED,96,eleifend pede libero quis orci nullam molestie nibh in lectus pellentesque at nulla suspendisse potenti,05/09/2019,COMPLETE,true
580,679,Multi-lateral 4th generation matrix,HIKEABLE_MILES,27,nulla pede ullamcorper augue a suscipit nulla elit ac nulla sed vel enim sit amet,11/21/2019,COMPLETE,true
581,48,Progressive uniform synergy,HIKEABLE_MILES,46,lacinia aenean sit amet justo morbi ut odio cras mi pede malesuada,02/07/2019,NOT_STARTED,true
582,266,Robust value-added matrices,MILES_HIKED,57,morbi odio odio elementum eu interdum eu tincidunt in leo maecenas pulvinar lobortis est phasellus,12/30/2019,COMPLETE,false
583,370,Operative multi-tasking help-desk,HIKEABLE_MILES,125,condimentum curabitur in libero ut massa volutpat convallis morbi odio,11/12/2019,IN_PROGRESS,true
584,339,Advanced value-added application,FEET_ASCENDED,25,turpis adipiscing lorem vitae mattis nibh ligula nec sem duis aliquam convallis nunc proin at turpis a pede,04/11/2019,COMPLETE,false
585,327,Optional multimedia flexibility,NUMBER_HIKES,65,non lectus aliquam sit amet diam in magna bibendum imperdiet nullam orci pede,05/04/2019,COMPLETE,true
586,522,Horizontal neutral alliance,MILES_HIKED,189,,04/03/2019,COMPLETE,false
587,863,Organized exuding info-mediaries,MILES_HIKED,56,odio odio elementum eu interdum eu tincidunt in leo maecenas pulvinar lobortis,03/15/2019,NOT_STARTED,false
588,214,Enterprise-wide local definition,HIKE_DIFFICULTY,256,cursus urna ut tellus nulla ut erat id mauris vulputate elementum nullam varius nulla facilisi cras non velit nec,04/25/2019,COMPLETE,true
589,774,Optional 6th generation groupware,FEET_ASCENDED,186,ultrices vel augue vestibulum ante ipsum primis in faucibus orci,09/29/2019,NOT_STARTED,true
590,811,Digitized systematic leverage,HIKEABLE_MILES,20,eget vulputate ut ultrices vel augue vestibulum ante ipsum primis in faucibus,04/07/2019,IN_PROGRESS,true
591,622,Team-oriented needs-based hierarchy,NUMBER_HIKES,168,ut blandit non interdum in ante vestibulum ante ipsum primis in faucibus orci luctus,05/26/2019,COMPLETE,true
592,969,Streamlined grid-enabled matrices,HIKE_DIFFICULTY,179,primis in faucibus orci luctus et ultrices posuere cubilia curae mauris viverra diam,11/12/2019,NOT_STARTED,true
593,7,Configurable neutral framework,NUMBER_HIKES,259,,03/30/2019,NOT_STARTED,false
594,92,Right-sized responsive alliance,FEET_ASCENDED,31,,02/26/2019,IN_PROGRESS,false
595,548,Multi-layered fresh-thinking info-mediaries,NUMBER_HIKES,18,,01/06/2020,IN_PROGRESS,false
596,395,Customizable stable analyzer,NUMBER_HIKES,283,magna vulputate luctus cum sociis natoque penatibus et magnis dis parturient montes nascetur ridiculus mus vivamus vestibulum,02/18/2019,NOT_STARTED,false
597,758,Fully-configurable multi-state monitoring,HIKEABLE_MILES,106,justo lacinia eget tincidunt eget tempus vel pede morbi porttitor lorem id ligula suspendisse ornare consequat lectus in est,07/01/2019,COMPLETE,true
598,695,Polarised actuating ability,MILES_HIKED,50,,04/08/2019,COMPLETE,true
599,25,Balanced upward-trending capacity,HIKE_DIFFICULTY,65,dictumst etiam faucibus cursus urna ut tellus nulla ut erat id mauris vulputate elementum nullam,11/10/2019,COMPLETE,false
600,296,Integrated real-time parallelism,HIKE_DIFFICULTY,186,imperdiet sapien urna pretium nisl ut volutpat sapien arcu sed augue aliquam erat volutpat in congue etiam justo,10/12/2019,NOT_STARTED,false
601,66,Fully-configurable uniform initiative,FEET_ASCENDED,262,sit amet eros suspendisse accumsan tortor quis turpis sed ante vivamus tortor duis mattis egestas metus,09/02/2019,COMPLETE,true
602,122,Ergonomic incremental data-warehouse,MILES_HIKED,103,elementum in hac habitasse platea dictumst morbi vestibulum velit id pretium iaculis diam erat fermentum justo nec condimentum neque,06/15/2019,NOT_STARTED,false
603,985,Re-engineered explicit throughput,FEET_ASCENDED,131,ac est lacinia nisi venenatis tristique fusce congue diam id ornare imperdiet sapien urna,01/11/2020,COMPLETE,true
604,607,Triple-buffered demand-driven circuit,HIKE_DIFFICULTY,81,convallis morbi odio odio elementum eu interdum eu tincidunt in leo maecenas pulvinar lobortis est,05/01/2019,NOT_STARTED,true
605,883,Upgradable intangible synergy,FEET_ASCENDED,226,fermentum donec ut mauris eget massa tempor convallis nulla neque libero convallis eget,08/27/2019,IN_PROGRESS,false
606,682,Profit-focused upward-trending structure,NUMBER_HIKES,55,,08/07/2019,NOT_STARTED,false
607,660,Assimilated transitional Graphic Interface,HIKE_DIFFICULTY,108,in consequat ut nulla sed accumsan felis ut at dolor quis odio consequat varius integer ac leo pellentesque ultrices mattis,08/23/2019,COMPLETE,true
608,788,Total radical artificial intelligence,NUMBER_HIKES,66,velit vivamus vel nulla eget eros elementum pellentesque quisque porta volutpat erat quisque erat eros viverra eget,12/05/2019,NOT_STARTED,true
609,944,Object-based intermediate Graphical User Interface,MILES_HIKED,191,,04/05/2019,IN_PROGRESS,false
610,927,Progressive asynchronous budgetary management,HIKEABLE_MILES,64,consequat varius integer ac leo pellentesque ultrices mattis odio donec vitae nisi nam ultrices libero,01/24/2019,COMPLETE,false
611,474,Programmable systemic hub,HIKEABLE_MILES,149,primis in faucibus orci luctus et ultrices posuere cubilia curae donec pharetra magna vestibulum,11/05/2019,IN_PROGRESS,true
612,123,Configurable stable encryption,HIKE_DIFFICULTY,233,metus aenean fermentum donec ut mauris eget massa tempor convallis nulla neque libero convallis eget eleifend,03/03/2019,COMPLETE,true
613,832,Persistent exuding paradigm,NUMBER_HIKES,111,pretium quis lectus suspendisse potenti in eleifend quam a odio in hac habitasse platea dictumst maecenas ut,06/09/2019,NOT_STARTED,true
614,560,Robust homogeneous implementation,HIKEABLE_MILES,218,pede ullamcorper augue a suscipit nulla elit ac nulla sed vel enim sit amet nunc viverra,05/26/2019,COMPLETE,true
615,485,Networked discrete time-frame,MILES_HIKED,86,orci luctus et ultrices posuere cubilia curae mauris viverra diam,12/05/2019,NOT_STARTED,false
616,947,Grass-roots exuding access,FEET_ASCENDED,130,velit eu est congue elementum in hac habitasse platea dictumst morbi vestibulum velit id pretium iaculis diam erat fermentum,09/27/2019,IN_PROGRESS,true
617,740,Centralized exuding protocol,FEET_ASCENDED,58,,05/28/2019,COMPLETE,true
618,404,Open-source national product,MILES_HIKED,26,sed tincidunt eu felis fusce posuere felis sed lacus morbi sem,07/28/2019,NOT_STARTED,false
619,344,Public-key contextually-based access,HIKEABLE_MILES,238,diam in magna bibendum imperdiet nullam orci pede venenatis non sodales sed tincidunt eu felis fusce posuere felis,12/30/2019,NOT_STARTED,false
620,957,Reverse-engineered eco-centric implementation,HIKEABLE_MILES,242,,05/20/2019,IN_PROGRESS,false
621,817,Pre-emptive client-driven encryption,HIKE_DIFFICULTY,87,sem fusce consequat nulla nisl nunc nisl duis bibendum felis sed interdum venenatis turpis enim blandit mi in porttitor pede,06/06/2019,IN_PROGRESS,true
