622,840,Cross-group tertiary migration,HIKEABLE_MILES,3,proin eu mi nulla ac enim in tempor turpis nec,10/03/2019,COMPLETE,false
623,155,Enhanced stable help-desk,HIKEABLE_MILES,182,aliquam augue quam sollicitudin vitae consectetuer eget rutrum at lorem integer tincidunt ante vel ipsum praesent blandit lacinia,12/22/2019,NOT_STARTED,true
624,709,Centralized needs-based encoding,FEET_ASCENDED,235,ut massa volutpat convallis morbi odio odio elementum eu interdum eu tincidunt in leo maecenas pulvinar lobortis est,10/19/2019,COMPLETE,true
625,875,Cross-group hybrid infrastructure,HIKEABLE_MILES,295,ut odio cras mi pede malesuada in imperdiet et commodo vulputate justo in blandit ultrices enim,01/02/2020,COMPLETE,false
626,781,Object-based interactive groupware,HIKE_DIFFICULTY,234,lacinia sapien quis libero nullam sit amet turpis elementum ligula vehicula consequat morbi a ipsum integer a nibh,09/25/2019,IN_PROGRESS,false
627,138,Organized hybrid functionalities,FEET_ASCENDED,159,natoque penatibus et magnis dis parturient montes nascetur ridiculus mus vivamus vestibulum sagittis sapien,05/08/2019,COMPLETE,false
628,301,Cloned homogeneous frame,MILES_HIKED,247,mauris eget massa tempor convallis nulla neque libero convallis eget,11/25/2019,NOT_STARTED,false
629,678,Universal multi-tasking paradigm,HIKEABLE_MILES,280,,04/26/2019,NOT_STARTED,false
630,516,Enhanced discrete encoding,MILES_HIKED,29,bibendum morbi non quam nec dui luctus rutrum nulla tellus in sagittis dui vel nisl duis,09/04/2019,NOT_STARTED,false
631,114,Expanded national matrix,FEET_ASCENDED,93,erat volutpat in congue etiam justo etiam pretium iaculis justo in hac habitasse,05/26/2019,NOT_STARTED,true
632,594,Polarised transitional system engine,HIKE_DIFFICULTY,229,rhoncus sed vestibulum sit amet cursus id turpis integer aliquet massa id lobortis convallis tortor risus dapibus augue vel,10/06/2019,NOT_STARTED,true
633,633,Expanded high-level methodology,FEET_ASCENDED,13,ultrices posuere cubilia curae nulla dapibus dolor vel est donec odio justo sollicitudin ut suscipit,04/09/2019,COMPLETE,true
634,674,Advanced intangible encoding,FEET_ASCENDED,255,morbi a ipsum integer a nibh in quis justo maecenas,05/11/2019,COMPLETE,false
635,729,Right-sized even-keeled interface,HIKEABLE_MILES,173,luctus cum sociis natoque penatibus et magnis dis parturient montes nascetur ridiculus mus vivamus vestibulum sagittis sapien cum sociis natoque,12/21/2019,NOT_STARTED,true
636,300,Quality-focused next generation protocol,MILES_HIKED,217,morbi sem mauris laoreet ut rhoncus aliquet pulvinar sed nisl nunc rhoncus dui vel sem sed sagittis nam congue,02/16/2019,COMPLETE,false
637,568,Innovative optimal attitude,NUMBER_HIKES,78,mauris sit amet eros suspendisse accumsan tortor quis turpis sed,11/04/2019,IN_PROGRESS,true
638,846,Reactive content-based process improvement,HIKE_DIFFICULTY,42,vitae nisi nam ultrices libero non mattis pulvinar nulla pede,11/01/2019,NOT_STARTED,true
639,625,Visionary bandwidth-monitored adapter,FEET_ASCENDED,212,lacinia aenean sit amet justo morbi ut odio cras mi pede,01/17/2020,IN_PROGRESS,true
640,77,Future-proofed foreground support,FEET_ASCENDED,296,nisi nam ultrices libero non mattis pulvinar nulla pede ullamcorper augue a suscipit nulla elit ac,11/22/2019,IN_PROGRESS,true
641,978,Integrated maximized workforce,FEET_ASCENDED,293,varius nulla facilisi cras non velit nec nisi vulputate nonummy maecenas tincidunt lacus at velit vivamus vel,07/29/2019,COMPLETE,false
642,449,Diverse uniform superstructure,FEET_ASCENDED,32,morbi non quam nec dui luctus rutrum nulla tellus in sagittis dui,05/31/2019,COMPLETE,true
643,804,User-centric explicit encoding,HIKE_DIFFICULTY,273,lacus curabitur at ipsum ac tellus semper interdum mauris ullamcorper purus sit,06/30/2019,COMPLETE,false
644,156,Vision-oriented methodical service-desk,FEET_ASCENDED,6,interdum mauris ullamcorper purus sit amet nulla quisque arcu libero rutrum ac lobortis vel,05/25/2019,NOT_STARTED,true
645,988,Visionary stable emulation,HIKE_DIFFICULTY,153,arcu sed augue aliquam erat volutpat in congue etiam justo etiam pretium iaculis justo in hac habitasse platea,05/08/2019,NOT_STARTED,false
646,470,Reverse-engineered human-resource firmware,HIKE_DIFFICULTY,101,lectus vestibulum quam sapien varius ut blandit non interdum in ante vestibulum ante ipsum primis in,12/28/2019,COMPLETE,false
647,830,Integrated leading edge help-desk,HIKE_DIFFICULTY,39,rutrum rutrum neque aenean auctor gravida sem praesent id massa id,03/16/2019,COMPLETE,true
648,557,Programmable client-server paradigm,NUMBER_HIKES,208,semper porta volutpat quam pede lobortis ligula sit amet eleifend pede libero quis orci nullam,04/14/2019,IN_PROGRESS,false
649,332,Cross-group homogeneous hierarchy,MILES_HIKED,281,erat tortor sollicitudin mi sit amet lobortis sapien sapien non mi integer ac neque duis,11/12/2019,NOT_STARTED,true
650,241,Business-focused 3rd generation pricing structure,MILES_HIKED,18,sollicitudin ut suscipit a feugiat et eros vestibulum ac est lacinia nisi venenatis tristique fusce congue diam,10/16/2019,NOT_STARTED,false
651,715,Synchronised zero tolerance solution,MILES_HIKED,83,magnis dis parturient montes nascetur ridiculus mus etiam vel augue vestibulum rutrum rutrum,07/07/2019,NOT_STARTED,false
652,345,User-centric object-oriented capability,HIKE_DIFFICULTY,191,duis aliquam convallis nunc proin at turpis a pede posuere nonummy integer non velit donec diam neque vestibulum,02/16/2019,IN_PROGRESS,true
653,826,Balanced object-oriented groupware,FEET_ASCENDED,272,augue a suscipit nulla elit ac nulla sed vel enim,05/16/2019,NOT_STARTED,false
654,632,Reduced zero defect matrix,FEET_ASCENDED,239,tristique fusce congue diam id ornare imperdiet sapien urna pretium nisl ut volutpat sapien arcu,11/16/2019,IN_PROGRESS,true
655,857,Right-sized asymmetric forecast,HIKE_DIFFICULTY,185,feugiat non pretium quis lectus suspendisse potenti in eleifend quam a odio in hac habitasse platea dictumst maecenas ut,10/24/2019,IN_PROGRESS,false
656,807,Streamlined systematic approach,HIKEABLE_MILES,133,fermentum justo nec condimentum neque sapien placerat ante nulla justo aliquam quis turpis eget elit sodales scelerisque mauris sit amet,11/11/2019,COMPLETE,true
657,697,Optimized foreground emulation,FEET_ASCENDED,43,ultrices posuere cubilia curae donec pharetra magna vestibulum aliquet ultrices erat,03/13/2019,COMPLETE,true
658,934,Team-oriented disintermediate encryption,MILES_HIKED,274,vestibulum ante ipsum primis in faucibus orci luctus et ultrices posuere cubilia curae duis faucibus accumsan,03/25/2019,IN_PROGRESS,false
659,359,Exclusive maximized info-mediaries,HIKE_DIFFICULTY,286,in purus eu magna vulputate luctus cum sociis natoque penatibus et magnis dis parturient montes,11/13/2019,NOT_STARTED,true
660,967,Upgradable motivating frame,HIKEABLE_MILES,287,nulla sed accumsan felis ut at dolor quis odio consequat varius integer ac leo pellentesque ultrices mattis,01/09/2020,IN_PROGRESS,false
661,135,Fully-configurable bandwidth-monitored system engine,HIKE_DIFFICULTY,209,rhoncus mauris enim leo rhoncus sed vestibulum sit amet cursus id turpis integer aliquet,07/04/2019,NOT_STARTED,false
662,937,Digitized mobile focus group,FEET_ASCENDED,291,amet turpis elementum ligula vehicula consequat morbi a ipsum integer a,03/28/2019,IN_PROGRESS,false
663,572,Optimized multi-state structure,NUMBER_HIKES,10,nibh quisque id justo sit amet sapien dignissim vestibulum vestibulum ante ipsum primis in faucibus orci luctus,09/19/2019,IN_PROGRESS,false
664,880,Cross-platform needs-based flexibility,NUMBER_HIKES,132,est risus auctor sed tristique in tempus sit amet sem fusce consequat nulla nisl nunc nisl,12/24/2019,IN_PROGRESS,true
665,267,Distributed logistical Graphical User Interface,FEET_ASCENDED,180,magnis dis parturient montes nascetur ridiculus mus etiam vel augue vestibulum rutrum rutrum,03/04/2019,NOT_STARTED,true
666,875,Organized content-based encryption,HIKEABLE_MILES,249,morbi a ipsum integer a nibh in quis justo maecenas rhoncus aliquam lacus morbi quis tortor id nulla ultrices,06/22/2019,NOT_STARTED,true
667,379,Enhanced fresh-thinking infrastructure,MILES_HIKED,40,,05/01/2019,NOT_STARTED,true
668,36,Phased 5th generation installation,HIKEABLE_MILES,83,,03/01/2019,NOT_STARTED,false
669,910,Balanced hybrid application,HIKEABLE_MILES,223,dignissim vestibulum vestibulum ante ipsum primis in faucibus orci luctus et ultrices posuere,04/23/2019,IN_PROGRESS,false
670,484,Quality-focused coherent budgetary management,MILES_HIKED,15,suspendisse accumsan tortor quis turpis sed ante vivamus tortor duis,06/29/2019,IN_PROGRESS,true
671,994,Vision-oriented encompassing intranet,MILES_HIKED,296,suscipit ligula in lacus curabitur at ipsum ac tellus semper interdum mauris,02/04/2019,COMPLETE,true
672,646,Multi-layered stable analyzer,FEET_ASCENDED,30,nulla tempus vivamus in felis eu sapien cursus vestibulum proin eu mi nulla,05/25/2019,COMPLETE,true
673,982,Customer-focused next generation superstructure,HIKEABLE_MILES,244,nulla nisl nunc nisl duis bibendum felis sed interdum venenatis turpis enim blandit mi,02/08/2019,NOT_STARTED,false
674,946,Object-based high-level success,NUMBER_HIKES,130,ut nunc vestibulum ante ipsum primis in faucibus orci luctus et ultrices posuere,03/27/2019,NOT_STARTED,true
675,754,Phased reciprocal concept,HIKEABLE_MILES,220,in leo maecenas pulvinar lobortis est phasellus sit amet erat nulla tempus vivamus in felis eu sapien cursus,08/28/2019,NOT_STARTED,false
676,423,Integrated hybrid budgetary management,NUMBER_HIKES,296,risus auctor sed tristique in tempus sit amet sem fusce consequat nulla nisl nunc,02/21/2019,COMPLETE,false
677,495,Inverse object-oriented Graphical User Interface,FEET_ASCENDED,260,dapibus augue vel accumsan tellus nisi eu orci mauris lacinia sapien quis libero nullam sit,09/22/2019,COMPLETE,true
678,281,Reactive client-driven customer loyalty,FEET_ASCENDED,140,posuere nonummy integer non velit donec diam neque vestibulum eget vulputate ut ultrices vel augue vestibulum ante,04/29/2019,IN_PROGRESS,true
679,841,Balanced modular encryption,HIKEABLE_MILES,287,bibendum felis sed interdum venenatis turpis enim blandit mi in porttitor pede justo eu,01/27/2019,NOT_STARTED,false
680,116,Configurable solution-oriented matrices,NUMBER_HIKES,175,amet eros suspendisse accumsan tortor quis turpis sed ante vivamus tortor duis mattis egestas metus aenean fermentum donec ut mauris,04/05/2019,COMPLETE,false
681,478,Configurable optimal contingency,MILES_HIKED,96,sed tristique in tempus sit amet sem fusce consequat nulla nisl nunc nisl duis bibendum felis sed,06/01/2019,NOT_STARTED,true
682,655,Function-based scalable definition,MILES_HIKED,277,sit amet nulla quisque arcu libero rutrum ac lobortis vel dapibus at diam nam,09/22/2019,IN_PROGRESS,false
683,822,Reverse-engineered systematic architecture,NUMBER_HIKES,5,nisi nam ultrices libero non mattis pulvinar nulla pede ullamcorper augue a suscipit nulla elit,05/25/2019,NOT_STARTED,false
684,67,Universal optimal workforce,HIKE_DIFFICULTY,115,tempus vivamus in felis eu sapien cursus vestibulum proin eu mi nulla ac,08/03/2019,NOT_STARTED,false
685,364,Reverse-engineered explicit customer loyalty,HIKE_DIFFICULTY,104,magna vulputate luctus cum sociis natoque penatibus et magnis dis parturient montes nascetur ridiculus mus vivamus vestibulum sagittis sapien cum,10/19/2019,COMPLETE,false
686,919,Enhanced executive approach,HIKEABLE_MILES,17,,03/16/2019,NOT_STARTED,false
687,292,Visionary foreground service-desk,NUMBER_HIKES,209,,09/24/2019,IN_PROGRESS,true
688,49,Organized incremental neural-net,HIKE_DIFFICULTY,69,sagittis sapien cum sociis natoque penatibus et magnis dis parturient,06/18/2019,IN_PROGRESS,true
689,659,Mandatory eco-centric knowledge user,FEET_ASCENDED,239,,08/24/2019,COMPLETE,true
690,47,Front-line impactful support,MILES_HIKED,187,orci luctus et ultrices posuere cubilia curae duis faucibus accumsan odio curabitur convallis duis consequat dui nec nisi volutpat eleifend,12/30/2019,IN_PROGRESS,false
691,399,Universal explicit adapter,FEET_ASCENDED,110,pede libero quis orci nullam molestie nibh in lectus pellentesque at nulla suspendisse potenti cras in purus eu magna vulputate,02/21/2019,COMPLETE,false
692,857,Horizontal contextually-based instruction set,HIKE_DIFFICULTY,49,nullam molestie nibh in lectus pellentesque at nulla suspendisse potenti cras in purus eu magna vulputate luctus cum,05/20/2019,COMPLETE,true
693,680,Virtual tertiary benchmark,MILES_HIKED,241,lectus aliquam sit amet diam in magna bibendum imperdiet nullam orci pede,06/28/2019,IN_PROGRESS,false
694,32,Exclusive exuding pricing structure,MILES_HIKED,198,nascetur ridiculus mus etiam vel augue vestibulum rutrum rutrum neque aenean auctor gravida sem praesent id,03/29/2019,COMPLETE,true
695,66,Cloned full-range system engine,MILES_HIKED,64,faucibus orci luctus et ultrices posuere cubilia curae duis faucibus accumsan odio,03/17/2019,NOT_STARTED,true
696,822,Polarised logistical hierarchy,FEET_ASCENDED,198,rhoncus sed vestibulum sit amet cursus id turpis integer aliquet massa id,06/15/2019,NOT_STARTED,false
697,602,Centralized web-enabled instruction set,HIKE_DIFFICULTY,146,at nulla suspendisse potenti cras in purus eu magna vulputate luctus cum sociis natoque penatibus et magnis dis,09/19/2019,IN_PROGRESS,false
698,324,Extended 24 hour throughput,HIKE_DIFFICULTY,4,diam neque vestibulum eget vulputate ut ultrices vel augue vestibulum ante ipsum primis,06/30/2019,COMPLETE,false
699,356,Progressive logistical parallelism,FEET_ASCENDED,198,adipiscing lorem vitae mattis nibh ligula nec sem duis aliquam,03/04/2019,NOT_STARTED,false
700,132,Implemented scalable service-desk,NUMBER_HIKES,264,magna ac consequat metus sapien ut nunc vestibulum ante ipsum primis in faucibus orci luctus et ultrices,09/14/2019,COMPLETE,false
701,343,Stand-alone contextually-based flexibility,NUMBER_HIKES,179,luctus nec molestie sed justo pellentesque viverra pede ac diam cras pellentesque volutpat dui maecenas tristique,07/22/2019,IN_PROGRESS,false
702,956,Multi-tiered clear-thinking project,HIKE_DIFFICULTY,263,viverra pede ac diam cras pellentesque volutpat dui maecenas tristique est et tempus semper est quam pharetra magna ac consequat,03/13/2019,IN_PROGRESS,true
703,366,Vision-oriented zero administration success,MILES_HIKED,89,sapien placerat ante nulla justo aliquam quis turpis eget elit sodales scelerisque mauris,02/23/2019,COMPLETE,true
704,753,Inverse cohesive solution,FEET_ASCENDED,166,eleifend donec ut dolor morbi vel lectus in quam fringilla rhoncus mauris enim,06/30/2019,IN_PROGRESS,true
705,725,Object-based next generation benchmark,FEET_ASCENDED,114,a suscipit nulla elit ac nulla sed vel enim sit amet nunc viverra dapibus nulla suscipit,08/03/2019,NOT_STARTED,false
706,302,Reverse-engineered multimedia solution,NUMBER_HIKES,299,vitae nisi nam ultrices libero non mattis pulvinar nulla pede,02/10/2019,IN_PROGRESS,false
707,651,Grass-roots hybrid data-warehouse,NUMBER_HIKES,283,nec condimentum neque sapien placerat ante nulla justo aliquam quis turpis eget elit sodales scelerisque mauris sit amet eros suspendisse,03/11/2019,NOT_STARTED,true
708,146,Profit-focused client-driven initiative,HIKE_DIFFICULTY,149,,10/17/2019,NOT_STARTED,true
709,778,Distributed discrete success,HIKEABLE_MILES,63,nonummy maecenas tincidunt lacus at velit vivamus vel nulla eget eros elementum pellentesque quisque porta volutpat erat,05/26/2019,COMPLETE,false
710,5,Versatile real-time flexibility,MILES_HIKED,121,platea dictumst morbi vestibulum velit id pretium iaculis diam erat fermentum justo nec condimentum neque sapien placerat ante nulla justo,08/01/2019,COMPLETE,false
711,549,Sharable contextually-based synergy,FEET_ASCENDED,232,sem mauris laoreet ut rhoncus aliquet pulvinar sed nisl nunc rhoncus,06/16/2019,IN_PROGRESS,true
712,321,Customizable zero tolerance product,HIKEABLE_MILES,34,orci pede venenatis non sodales sed tincidunt eu felis fusce posuere felis,09/18/2019,COMPLETE,false
713,643,Innovative object-oriented structure,MILES_HIKED,43,pellentesque ultrices phasellus id sapien in sapien iaculis congue vivamus metus arcu adipiscing molestie hendrerit at vulputate vitae,09/18/2019,COMPLETE,false
714,78,Secured empowering complexity,HIKE_DIFFICULTY,297,,11/06/2019,IN_PROGRESS,false
715,994,Multi-tiered 6th generation Graphical User Interface,MILES_HIKED,282,nulla ultrices aliquet maecenas leo odio condimentum id luctus nec molestie sed justo,02/27/2019,IN_PROGRESS,false
716,238,Pre-emptive eco-centric hardware,NUMBER_HIKES,207,lacus at turpis donec posuere metus vitae ipsum aliquam non mauris morbi,01/21/2019,IN_PROGRESS,false
717,811,Fully-configurable background matrix,FEET_ASCENDED,58,phasellus sit amet erat nulla tempus vivamus in felis eu sapien cursus vestibulum proin,10/15/2019,NOT_STARTED,false
718,479,Ergonomic contextually-based toolset,HIKE_DIFFICULTY,159,volutpat dui maecenas tristique est et tempus semper est quam pharetra magna ac,09/13/2019,COMPLETE,false
719,198,Robust 24 hour framework,MILES_HIKED,72,curae mauris viverra diam vitae quam suspendisse potenti nullam porttitor lacus at,07/18/2019,NOT_STARTED,false
720,221,De-engineered exuding website,FEET_ASCENDED,11,in consequat ut nulla sed accumsan felis ut at dolor quis odio consequat varius integer,10/09/2019,NOT_STARTED,false
721,404,Enhanced coherent forecast,HIKE_DIFFICULTY,280,elit sodales scelerisque mauris sit amet eros suspendisse accumsan tortor,10/04/2019,IN_PROGRESS,false
722,523,De-engineered real-time architecture,NUMBER_HIKES,37,nulla suscipit ligula in lacus curabitur at ipsum ac tellus,04/09/2019,COMPLETE,true
723,151,Mandatory 24 hour utilisation,HIKEABLE_MILES,218,tempus vel pede morbi porttitor lorem id ligula suspendisse ornare consequat lectus in,07/09/2019,COMPLETE,false
724,223,Diverse foreground extranet,FEET_ASCENDED,251,,08/09/2019,COMPLETE,false
725,691,Polarised fresh-thinking infrastructure,HIKEABLE_MILES,198,in congue etiam justo etiam pretium iaculis justo in hac habitasse platea dictumst etiam faucibus,06/07/2019,NOT_STARTED,true
726,254,Total tangible moderator,MILES_HIKED,72,pulvinar lobortis est phasellus sit amet erat nulla tempus vivamus,03/13/2019,NOT_STARTED,true
727,114,Self-enabling bi-directional toolset,MILES_HIKED,257,tortor sollicitudin mi sit amet lobortis sapien sapien non mi,08/14/2019,IN_PROGRESS,true
728,324,Up-sized tertiary approach,NUMBER_HIKES,165,ut odio cras mi pede malesuada in imperdiet et commodo vulputate justo in blandit,10/07/2019,NOT_STARTED,false
729,715,Universal maximized paradigm,MILES_HIKED,219,pede malesuada in imperdiet et commodo vulputate justo in blandit ultrices enim lorem ipsum dolor,07/29/2019,NOT_STARTED,true
730,873,Networked global intranet,HIKEABLE_MILES,290,congue vivamus metus arcu adipiscing molestie hendrerit at vulputate vitae nisl aenean lectus pellentesque eget nunc,08/13/2019,IN_PROGRESS,true
731,856,Managed mission-critical contingency,HIKE_DIFFICULTY,217,,05/07/2019,NOT_STARTED,true
732,798,Secured needs-based complexity,HIKE_DIFFICULTY,137,ullamcorper augue a suscipit nulla elit ac nulla sed vel enim sit amet nunc viverra dapibus nulla suscipit ligula in,03/05/2019,IN_PROGRESS,false
733,407,Grass-roots systemic hierarchy,FEET_ASCENDED,269,et magnis dis parturient montes nascetur ridiculus mus vivamus vestibulum sagittis sapien cum sociis natoque,06/30/2019,IN_PROGRESS,false
734,156,Visionary eco-centric project,HIKE_DIFFICULTY,109,dapibus nulla suscipit ligula in lacus curabitur at ipsum ac tellus semper interdum mauris ullamcorper purus sit amet nulla quisque,04/06/2019,IN_PROGRESS,false
735,431,Centralized static orchestration,MILES_HIKED,69,erat nulla tempus vivamus in felis eu sapien cursus vestibulum proin eu mi nulla ac enim in tempor turpis,06/04/2019,IN_PROGRESS,false
736,502,Seamless modular collaboration,HIKEABLE_MILES,141,pellentesque viverra pede ac diam cras pellentesque volutpat dui maecenas tristique,01/04/2020,NOT_STARTED,false
737,905,Stand-alone systemic superstructure,MILES_HIKED,143,mauris sit amet eros suspendisse accumsan tortor quis turpis sed ante,10/02/2019,IN_PROGRESS,false
738,148,Streamlined stable knowledge user,MILES_HIKED,129,duis mattis egestas metus aenean fermentum donec ut mauris eget massa tempor convallis nulla neque libero convallis eget,08/15/2019,IN_PROGRESS,true
739,561,Polarised modular workforce,HIKEABLE_MILES,139,vivamus vestibulum sagittis sapien cum sociis natoque penatibus et magnis dis parturient montes nascetur ridiculus,09/26/2019,NOT_STARTED,false
740,282,Monitored user-facing hub,FEET_ASCENDED,282,consequat nulla nisl nunc nisl duis bibendum felis sed interdum,07/04/2019,COMPLETE,true
741,867,Vision-oriented client-server initiative,MILES_HIKED,276,lectus pellentesque eget nunc donec quis orci eget orci vehicula condimentum curabitur in,04/08/2019,NOT_STARTED,false
742,859,Polarised asymmetric workforce,HIKEABLE_MILES,59,convallis duis consequat dui nec nisi volutpat eleifend donec ut dolor morbi vel lectus in quam fringilla rhoncus,12/31/2019,NOT_STARTED,true
743,63,Organized foreground open architecture,HIKE_DIFFICULTY,235,augue vestibulum ante ipsum primis in faucibus orci luctus et ultrices posuere cubilia curae donec pharetra,02/08/2019,COMPLETE,false
744,189,Re-engineered 5th generation complexity,HIKEABLE_MILES,50,vel pede morbi porttitor lorem id ligula suspendisse ornare consequat lectus,11/08/2019,IN_PROGRESS,true
745,785,Open-source didactic firmware,HIKE_DIFFICULTY,213,placerat ante nulla justo aliquam quis turpis eget elit sodales scelerisque mauris sit amet eros suspendisse accumsan,03/26/2019,IN_PROGRESS,false
746,10,Future-proofed directional data-warehouse,MILES_HIKED,105,lectus vestibulum quam sapien varius ut blandit non interdum in ante vestibulum ante ipsum,10/08/2019,COMPLETE,true
747,66,Monitored hybrid initiative,MILES_HIKED,158,convallis tortor risus dapibus augue vel accumsan tellus nisi eu orci mauris lacinia sapien quis libero nullam,02/23/2019,NOT_STARTED,true
748,719,Universal responsive utilisation,HIKEABLE_MILES,146,,02/09/2019,IN_PROGRESS,true
749,758,Configurable content-based projection,HIKE_DIFFICULTY,15,quisque erat eros viverra eget congue eget semper rutrum nulla,02/28/2019,IN_PROGRESS,false
750,352,Optional full-range contingency,FEET_ASCENDED,300,,12/03/2019,NOT_STARTED,false
751,377,Function-based secondary website,FEET_ASCENDED,209,orci luctus et ultrices posuere cubilia curae duis faucibus accumsan odio curabitur convallis duis consequat dui nec nisi volutpat eleifend,03/05/2019,IN_PROGRESS,true
752,849,Intuitive static local area network,FEET_ASCENDED,207,imperdiet nullam orci pede venenatis non sodales sed tincidunt eu felis fusce,01/12/2020,IN_PROGRESS,false
753,763,Face to face non-volatile pricing structure,FEET_ASCENDED,136,nullam porttitor lacus at turpis donec posuere metus vitae ipsum,06/10/2019,COMPLETE,true
754,456,Enterprise-wide explicit definition,HIKEABLE_MILES,150,vehicula condimentum curabitur in libero ut massa volutpat convallis morbi odio odio elementum eu interdum,08/16/2019,IN_PROGRESS,true
755,700,Object-based zero defect middleware,MILES_HIKED,279,consequat ut nulla sed accumsan felis ut at dolor quis odio consequat varius integer ac leo pellentesque ultrices mattis,04/21/2019,IN_PROGRESS,true
756,123,Total optimizing system engine,NUMBER_HIKES,182,in libero ut massa volutpat convallis morbi odio odio elementum eu interdum eu tincidunt in leo maecenas pulvinar,04/18/2019,IN_PROGRESS,true
757,342,Extended bifurcated alliance,HIKEABLE_MILES,172,amet nunc viverra dapibus nulla suscipit ligula in lacus curabitur at ipsum ac,06/12/2019,NOT_STARTED,true
758,1000,Horizontal directional Graphical User Interface,FEET_ASCENDED,40,phasellus in felis donec semper sapien a libero nam dui proin,03/06/2019,COMPLETE,false
759,193,Diverse 6th generation strategy,MILES_HIKED,217,,09/12/2019,NOT_STARTED,true
760,540,Synergized needs-based policy,HIKEABLE_MILES,85,orci eget orci vehicula condimentum curabitur in libero ut massa volutpat convallis morbi odio odio elementum eu interdum,10/21/2019,COMPLETE,true
761,395,Customizable full-range orchestration,FEET_ASCENDED,151,in est risus auctor sed tristique in tempus sit amet sem fusce consequat nulla nisl,02/15/2019,NOT_STARTED,false
762,458,Upgradable local knowledge base,HIKE_DIFFICULTY,61,fermentum justo nec condimentum neque sapien placerat ante nulla justo aliquam quis turpis eget elit sodales,08/25/2019,IN_PROGRESS,true
763,838,Adaptive methodical process improvement,MILES_HIKED,39,,10/28/2019,NOT_STARTED,true
764,264,Sharable non-volatile implementation,HIKEABLE_MILES,233,dui vel nisl duis ac nibh fusce lacus purus aliquet at feugiat non,12/30/2019,COMPLETE,false
765,477,Assimilated encompassing knowledge base,FEET_ASCENDED,18,,03/20/2019,COMPLETE,true
766,13,Object-based 3rd generation customer loyalty,FEET_ASCENDED,41,ante nulla justo aliquam quis turpis eget elit sodales scelerisque mauris sit amet eros suspendisse accumsan tortor quis,03/06/2019,COMPLETE,true
767,85,Enterprise-wide system-worthy capacity,FEET_ASCENDED,172,imperdiet et commodo vulputate justo in blandit ultrices enim lorem ipsum dolor sit amet consectetuer adipiscing elit proin interdum,07/07/2019,NOT_STARTED,true
768,280,Expanded methodical analyzer,FEET_ASCENDED,296,id luctus nec molestie sed justo pellentesque viverra pede ac diam cras,10/02/2019,NOT_STARTED,false
769,590,Re-engineered discrete migration,HIKEABLE_MILES,76,cursus id turpis integer aliquet massa id lobortis convallis tortor,06/29/2019,COMPLETE,false
770,980,Balanced neutral synergy,MILES_HIKED,187,id nisl venenatis lacinia aenean sit amet justo morbi ut odio,11/08/2019,IN_PROGRESS,false
771,841,Total mobile productivity,MILES_HIKED,136,,07/21/2019,IN_PROGRESS,false
